The Adler Planetarium,126,Science,A planetarium with a variety of shows and exhibits about astronomy and space exploration.
The International Museum of Surgical Science,126,History,A museum dedicated to the history of medicine and surgery.
The Museum of Broadcast Communications,126,Media,A museum dedicated to the history of broadcasting and the media.
Pérez Art Museum Miami,127,Art,A contemporary art museum with a focus on Latin American and Caribbean art.
HistoryMiami Museum,127,History,A museum dedicated to the history of Miami and South Florida.
Miami Children's Museum,127,Children's,A hands-on museum for children of all ages.
Vizcaya Museum and Gardens,127,Historic House,A former winter estate of a wealthy industrialist
The Bass,127,Art,A museum of contemporary art housed in a historic Art Deco building.
Phillip and Patricia Frost Museum of Science,127,Science,A science museum with interactive exhibits on a variety of topics
Museum of Graffiti,127,Art,A museum dedicated to the history and culture of graffiti art.
Museum of Contemporary Art,127,Art,A contemporary art museum with a focus on international art.
Morikami Museum and Japanese Gardens,127,Botanic Garden,A museum and Japanese garden dedicated to the culture and history of Japan.
Rubell Museum,127,Art,A private museum with a large collection of contemporary art.
Bay of Pigs Museum & Library,127,History,A museum dedicated to the Bay of Pigs Invasion.
The Margulies Collection at the WAREhOUSE,127,Art,A private collection of contemporary art housed in a former warehouse.
The Wolfsonian-Florida International University,127,History,A museum dedicated to the history of design and propaganda.
Jewish Museum of Florida-FIU,127,Ethnic,A museum dedicated to the history and culture of the Jewish people in Florida.
Cubaocho Museum & Performing Arts Center,127,Culture,A museum and performing arts center dedicated to the culture of Cuba.
American Museum of the Cuban Diaspora,127,Ethnic,A museum dedicated to the history and culture of Cuban Americans.
Lock & Load Miami: Machine Gun Experience & Range,127,Military,A museum and shooting range with a collection of firearms.
de la Cruz Collection,127,Art,A private collection of contemporary art.
Historic Black Police Precinct Courthouse and Museum,127,History,A museum dedicated to the history of the Miami Police Department.
Coral Gables Museum,127,History,A museum dedicated to the history of Coral Gables.
Haitian Heritage Museum,127,Ethnic,A museum dedicated to the history and culture of Haitian Americans.
Rubell Museum,127,Art,A private museum with a large collection of contemporary art.
Wings Over Miami Museum,127,Military,A museum dedicated to the history of aviation in Miami.
Deering Estate,127,Historic House,A former estate of a wealthy industrialist
World Erotic Art Museum,127,Ethnic,A museum dedicated to the history and culture of erotic art.
Lowe Art Museum,127,Art,An art museum with a collection of European
Museum of Illusions,127,Art,A museum with interactive exhibits that create optical illusions.
Coral Castle,127,Historic House,A mysterious rock garden built by a Latvian immigrant.
El Espacio 23,127,Art,A contemporary art gallery.
Paradox Museum Miami,127,Art,A museum with interactive exhibits that challenge visitors' perceptions of reality.
NSU Art Museum Fort Lauderdale,127,Art,An art museum with a collection of European
Museum of Discovery and Science,127,Science,A science museum with interactive exhibits on a variety of topics
Morikami Museum and Japanese Gardens,127,Botanic Garden,A museum and Japanese garden dedicated to the culture and history of Japan.
ARTECHOUSE Miami,127,Art,A museum with interactive exhibits that use technology to create immersive experiences.
Norton Museum of Art,127,Art,An art museum with a collection of European
Boca Raton Museum of Art,127,Art,An art museum with a collection of European
Seminole Okalee Indian Village and Museum,127,Ethnic,A museum dedicated to the culture of the Seminole people.
High Museum of Art,128,Art,The museum has a collection of art from around the world including paintings sculptures and decorative arts.
Atlanta History Center,128,History,The center has exhibits on the history of Atlanta and the surrounding area.
The World of Coca-Cola,128,History,The museum is dedicated to the history of Coca-Cola.
Georgia Aquarium,128,Botanic Garden,The aquarium is home to over 100000 marine animals.
Martin Luther King  Jr. National Historic Site,128,Histoty,The site is dedicated to the life and work of Martin Luther King Jr.
Dallas Museum of Art,129,Art,One of the largest museums in the Southwest
Perot Museum of Nature and Science,129,Science,A family-friendly museum with interactive exhibits on science and nature.
George W. Bush Presidential Library and Museum,129,History,A museum dedicated to the life and presidency of George W. Bush.
Six Flags Over Texas,129,Amusement,A theme park with roller coasters
Frontier Heritage Museum,129,History,A museum dedicated to the history of the American West.
Dallas Holocaust Museum,129,Ethnic,A museum dedicated to the Holocaust.
The Sixth Floor Museum at Dealey Plaza,129,History,A museum dedicated to the assassination of President John F. Kennedy.
The Crow Museum of Asian Art,129,Art,A museum dedicated to Asian art.
The Nasher Sculpture Center,129,Art,A museum dedicated to modern and contemporary sculpture.
Philadelphia Museum of Art,130,Art,One of the largest and most comprehensive art museums in the United States.
Independence Hall,130,History,The building where the Declaration of Independence and the Constitution were signed.
Eastern State Penitentiary,130,Historic House,A former prison that is now a museum.
African American Museum in Philadelphia,130,Ethnic,A museum that tells the story of African Americans in Philadelphia.
Please Touch Museum,130,Children's,A museum designed for children to learn through play.
Museum of the American Revolution,130,History,A museum that tells the story of the American Revolution.
Boston Museum of Fine Arts,131,Art,One of the largest and most comprehensive art museums in the United States.
Isabella Stewart Gardner Museum,131,Art,A museum that houses a collection of European art.
Museum of Science,131,Science,A museum that focuses on science and technology.
Faneuil Hall,131,History,A building that was once a marketplace and is now a museum.
USS Constitution Museum,131,Maritime,A museum that tells the story of the USS Constitution
de Young Museum,132,Art,The de Young Museum is a fine arts museum located in Golden Gate Park
California Academy of Sciences,132,Science,The California Academy of Sciences is a natural history museum located in Golden Gate Park
SFMOMA,132,Art,The San Francisco Museum of Modern Art (SFMOMA) is a modern and contemporary art museum located in San Francisco
Legion of Honor,132,Art,The Legion of Honor is a museum in San Francisco
Japanese Tea Garden,132,Botanic Garden,The Japanese Tea Garden is a traditional Japanese garden located in Golden Gate Park
Walt Disney Family Museum,132,History,The Walt Disney Family Museum is a museum dedicated to the life and work of Walt Disney. It is located in the Presidio of San Francisco
Museum of the African Diaspora,132,Ethnic,The Museum of the African Diaspora (MoAD) is a museum in San Francisco
Children's Creativity Museum,132,Children's,The Children's Creativity Museum is a museum in San Francisco
San Francisco Maritime Museum,132,Maritime,The San Francisco Maritime Museum is a maritime museum located in Fisherman's Wharf
San Francisco Museum of Modern Transportation,132,Transportation,The San Francisco Museum of Modern Transportation (SFMoT) is a museum dedicated to the history of transportation in San Francisco
San Diego Museum of Art,133,Art,A museum that houses a collection of European and American art.
San Diego Air & Space Museum,133,Transportation,A museum that tells the story of aviation and space exploration.
San Diego Zoo,133,Botanic Garden,A zoo that is home to over 3
San Diego Children's Museum,133,Children's,A museum designed for children to learn through play.
San Jose Museum of Art,134,Art,A contemporary art museum with a focus on California and Latin American art.
Tech Museum of Innovation,134,Science,A hands-on museum that explores science and technology through interactive exhibits.
Children's Discovery Museum of San Jose,134,Children's,A museum for children ages 10 and under that offers a variety of interactive exhibits.
San Jose Historical Museum,134,History,A museum that tells the story of San Jose and its people.
Tech Interactive,134,Multiple,A science and technology center with a variety of exhibits and programs.
San Jose Museum of Quilts & Textiles,134,Textile,A museum that preserves and exhibits quilts and textiles from around the world.
San Jose Museum of Flight,134,Aviation,A museum that tells the story of flight through exhibits and aircraft.
San Jose Flea Market,134,Multiple,A large outdoor flea market with a variety of vendors selling goods and services.
San Jose Improv,134,Comedy,A comedy club that hosts a variety of national and local comedians.
San Jose Sharks Ice,134,Sports,A hockey arena that is home to the San Jose Sharks.
Houston Museum of Natural Science,135,Science,A natural history museum with a variety of exhibits on dinosaurs
Children's Museum of Houston,135,Children's,A museum for children ages 10 and under that offers a variety of interactive exhibits.
Space Center Houston,135,Aviation,A museum that tells the story of human spaceflight through exhibits and artifacts.
Houston Zoo,135,Zoology,A zoo that is home to over 6
Museum of Fine Arts,135,Art,An art museum with a collection of over 60
Asia Society Texas Center,135,Art,An art museum that focuses on Asian art and culture.
Museum of Contemporary Art Houston,135,Art,A contemporary art museum with a focus on Texas and Latin American art.
Houston Holocaust Museum,135,History,A museum that tells the story of the Holocaust.
Houston Museum of African American Culture,135,Ethnic,A museum that celebrates African American culture and history.
Houston Fire Museum,135,Firefighting,A museum that tells the story of the Houston Fire Department.
Phoenix Art Museum,136,Art,An art museum with a collection of over 18
Heard Museum,136,Ethnic,A museum that celebrates Native American art and culture.
Children's Museum of Phoenix,136,Children's,A museum for children ages 10 and under that offers a variety of interactive exhibits.
Arizona Science Center,136,Science,A science museum with a variety of exhibits on science and technology.
Musical Instrument Museum,136,Music,A museum that houses a collection of over 15
Desert Botanical Garden,136,Botanic Garden,A botanical garden that features plants from the Sonoran Desert.
Phoenix Zoo,136,Zoology,A zoo that is home to over 1
Detroit Institute of Arts,137,Art,The Detroit Institute of Arts (DIA) is an art museum in Detroit
Motown Museum,137,History,The Motown Museum is a museum in Detroit
Detroit Historical Museum,137,History,The Detroit Historical Museum is a museum in Detroit
Denver Art Museum,138,Art,A world-renowned art museum with a collection of over 70
Denver Museum of Nature & Science,138,Science,A natural history museum with exhibits on dinosaurs
Clyfford Still Museum,138,Art,A museum dedicated to the work of American painter Clyfford Still.
Denver Botanic Gardens,138,Botanic Garden,A 100-acre botanical garden with a variety of gardens and exhibits.
History Colorado Center,138,History,A museum of Colorado history with exhibits on the state's past.
San Antonio Museum of Art,139,Art,The San Antonio Museum of Art (SAMA) is an art museum in San Antonio
The Witte Museum,139,History,The Witte Museum is a natural history museum in San Antonio
The San Antonio Missions National Historical Park,139,History,The San Antonio Missions National Historical Park is a national historical park in San Antonio
The McNay Art Museum,139,Art,The McNay Art Museum is an art museum in San Antonio
Museum of Flight,140,Science,The Museum of Flight is an aviation and aerospace museum in Seattle
Pacific Science Center,140,Science,The Pacific Science Center is a science museum in Seattle
Seattle Art Museum,140,Art,The Seattle Art Museum is an art museum in Seattle
Nashville Children's Museum,141,Children's,The Nashville Children's Museum is a children's museum in Nashville
Country Music Hall of Fame and Museum,141,Music,The Country Music Hall of Fame and Museum is a museum in Nashville
Tennessee State Museum,141,History,The Tennessee State Museum is a museum in Nashville
Tashkent State Museum of Fine Arts,142,Art,A museum that houses a collection of art from Central Asia.
Amir Timur Museum,142,History,A museum dedicated to the life and achievements of Amir Timur.
Humayun's Tomb,142,Historic House,The tomb of Mughal emperor Humayun.
Bibi-Khanum Mosque,142,History,A mosque that was built in the 15th century.
Registan,142,Market,A square that is surrounded by three madrasas.
Tashkent Circus,142,Amusement,A circus that is home to a variety of performers.
The War Remnants Museum,143,History,The museum is dedicated to the Vietnam War.
The Ho Chi Minh City Museum,143,History,The museum is dedicated to the history of Ho Chi Minh City.
The Fine Arts Museum of Ho Chi Minh City,143,Art,The museum has a collection of Vietnamese art.
The Museum of Vietnamese History,143,History,The museum is dedicated to the history of Vietnam.
The Museum of Ethnology,143,Ethnic,The museum has exhibits on the cultures of Vietnam's ethnic minorities.
Ho Chi Minh Mausoleum,144,History,The mausoleum is the final resting place of Ho Chi Minh the founder of the Socialist Republic of Vietnam.
The Temple of Literature,144,History,The temple is dedicated to Confucius and other scholars.
The Vietnam Military History Museum,144,History,The museum is dedicated to the history of the Vietnamese military.
The Vietnam National Museum of Fine Arts,144,Art,The museum has a collection of Vietnamese art.
The Vietnam Museum of Ethnology,144,Ethnic,The museum has exhibits on the cultures of Vietnam's ethnic minorities.
Acropolis Museum,145,History, The official residence of the monarch of the United Kingdom since the 18th century
The Getty Center,146,Art,The Getty Center is a hilltop complex of art museums and research institutes in the Westwood neighborhood of Los Angeles
The Broad,146,Art,The Broad is a contemporary art museum in the Grand Avenue Arts District of downtown Los Angeles.
The Los Angeles County Museum of Art (LACMA),146,Art,The Los Angeles County Museum of Art (LACMA) is an art museum in Los Angeles
The Natural History Museum of Los Angeles County,146,Science,The Natural History Museum of Los Angeles County (NHM) is a natural history museum located in Exposition Park
The California Science Center,146,Science,The California Science Center is a science museum located in Exposition Park
The Japanese American National Museum,146,History,The Japanese American National Museum is a museum located in Little Tokyo
The Autry Museum of the American West,146,History,The Autry Museum of the American West is a museum located in Griffith Park
The Skirball Cultural Center,146,Culture,The Skirball Cultural Center is a Jewish cultural center located in Brentwood
Spokane Children's Museum,147,Children's,A hands-on museum for children of all ages.
Northwest Museum of Arts & Culture,147,Art,A museum with a collection of over 17
Spokane Falls Discovery Museum,147,Children's,A hands-on museum for children of all ages.
Mobius Science Center,147,Science,A science museum with exhibits on science and technology.
Spokane Indian Museum,147,Ethnic,A museum dedicated to the history and culture of the Spokane people.
