Pinacoteca di Brera,77,Art,The Pinacoteca di Brera is an art museum located in Milan. The museum houses a collection of Italian paintings from the 14th to the 19th centuries. The museum's collection includes works by Leonardo da Vinci
Sforza Castle,77,History,Sforza Castle is a castle located in Milan. The castle was built in the 15th century by Francesco Sforza. The castle is now a museum and a cultural center.
Brera Academy,77,Art,The Brera Academy is an art school located in Milan. The school was founded in 1776. The school's alumni include artists such as Giuseppe Verdi
Museo Nazionale della Scienza e della Tecnologia Leonardo da Vinci,77,Science,The Museo Nazionale della Scienza e della Tecnologia Leonardo da Vinci is a science museum located in Milan. The museum is dedicated to the life and work of Leonardo da Vinci. The museum has a collection of over 15
Museo Nazionale della Montagna,77,Ethnic,The Museo Nazionale della Montagna is an ethnic museum located in Turin. The museum is dedicated to the history and culture of the mountains. The museum has a collection of over 100
Museo Egizio,77,History,The Museo Egizio is an Egyptian museum located in Turin. The museum is one of the largest and most important Egyptian museums in the world. The museum has a collection of over 30
Musée des civilisations de Côte d'Ivoire,78,Art,A museum of African art and culture.
Musée national de la Côte d'Ivoire,78,History,A museum of Ivorian history and culture.
Musée des arts et traditions populaires,78,Ethnic,A museum of Ivorian folk art and culture.
Musée National des Arts et Traditions Populaires,78,Ethnic,The National Museum of Arts and Popular Traditions is a museum in Abidjan
Tokyo National Museum,79,Art,The largest art museum in Japan
Mori Art Museum,79,Art,A museum of contemporary art that specializes in exhibitions of cutting-edge art from around the world.
National Museum of Nature and Science,79,Science,A museum that houses a variety of exhibits on science and nature
Tokyo Metropolitan Museum of Art,79,Art,A museum that houses a collection of over 100
Fukuoka City Museum,80,History,A museum located in Fukuoka Japan.
Fukuoka Asian Art Museum,80,Art,A museum located in Fukuoka Japan.
Hakodate Museum of Art,81,Art,A museum located in Sapporo Japan.
Sapporo Beer Museum,81,History,A museum located in Sapporo Japan.
National Museum of Nature and Science,82,Science,The National Museum of Nature and Science is a natural history and science museum in Osaka Japan. It is one of the largest museums in Japan with over 15 million visitors annually. The museum has a wide variety of exhibits including dinosaur fossils space exploration artifacts and a planetarium.
Osaka Museum of Art,82,Art,The Osaka Museum of Art is an art museum in Osaka Japan. It was founded in 1961 and houses a collection of over 10000 works of art including paintings sculptures and prints. The museum also has a library and a research center.
Hiroshima Peace Memorial Park,83,History,Hiroshima Peace Memorial Park is a memorial park in Hiroshima Japan. It was created in 1954 to commemorate the victims of the atomic bombing of Hiroshima in 1945. The park includes the Hiroshima Peace Memorial Museum the Atomic Bomb Dome and the Hiroshima Peace Memorial Cenotaph.
Atomic Bomb Dome,83,Historic House,The Atomic Bomb Dome is a building in Hiroshima Japan that was partially destroyed by the atomic bombing of Hiroshima in 1945. The building is now a UNESCO World Heritage Site and a symbol of peace.
Jordan Museum,84,History,The Jordan Museum is the largest archaeological museum in Jordan. It is located in Amman the capital of Jordan. The museum houses a large collection of artifacts from Jordan's ancient history including the Dead Sea Scrolls.
Roman Theater,84,History,The Roman Theater is an ancient theater located in Amman Jordan. It was built in the 2nd century AD and is one of the best-preserved Roman theaters in the world. The theater can seat up to 6000 people and is used for a variety of events including concerts plays and festivals.
Jordan Archaeological Museum,84,History,The Jordan Archaeological Museum is a museum located in Amman Jordan. It houses a large collection of artifacts from Jordan's ancient history including the Dead Sea Scrolls.
Folklore Museum,84,Culture,The Folklore Museum is a museum located in Amman Jordan. It houses a collection of artifacts that represent the different cultures of Jordan. The museum also has a library and a research center.
Children's Museum,84,Children's,The Children's Museum is a museum located in Amman Jordan. It is designed for children and families to learn about science art and culture through interactive exhibits.
Nairobi National Museum,85,History,The Nairobi National Museum is a museum in Nairobi
Kuwait National Museum,86,History,The Kuwait National Museum is a museum in Kuwait City
National Museum of Anthropology,87,Ethnic, A vast complex of museums and palaces in St. Petersburg
Casablanca Museum of Moroccan Arts,88,Ethnic,The Casablanca Museum of Moroccan Arts is a museum in Casablanca Morocco. It was founded in 1915 and houses a collection of over 10000 works of art including paintings sculptures and textiles. The museum also has a library and a research center.
Kathmandu National Museum,89,History,The Kathmandu National Museum is a museum in Kathmandu Nepal. It was founded in 1951 and houses a collection of over 100000 artifacts including sculptures paintings and manuscripts. The museum also has a library and a research center.
Musée de la Marine,90,Maritime,A museum of the Dutch maritime history.
Rijksmuseum,90,Art,A museum of Dutch and European art.
Van Gogh Museum,90,Art,A museum of the works of Vincent van Gogh.
Anne Frank House,90,Historic House,The former home of Anne Frank
Nederlands Scheepvaartmuseum,90,Maritime,A museum of Dutch maritime history.
Science Centre NEMO,90,Science,A science museum for children and adults.
Tropenmuseum,90,Ethnic,A museum of the cultures of Africa
Hausa National Museum,91,Ethnic,The Hausa National Museum is a museum in Kano
Korean War Museum,92,Military,The Korean War Museum is a museum in Pyongyang North Korea. It was founded in 1953 and houses a collection of over 100000 artifacts including weapons uniforms and photographs. The museum also has a library and a research center.
Karachi Museum,93,Art,The Karachi Museum is a museum in Karachi Pakistan. It was founded in 1950 and houses a collection of over 50000 artifacts including paintings sculptures and textiles. The museum also has a library and a research center.
Lahore Museum,94,History,The Lahore Museum is a museum in Lahore Pakistan. It was founded in 1864 and houses a collection of over 100000 artifacts including paintings sculptures and manuscripts. The museum also has a library and a research center.
Faisalabad Museum,95,History,The Faisalabad Museum is a museum in Faisalabad Pakistan. It was founded in 1963 and houses a collection of over 50000 artifacts including paintings sculptures and textiles. The museum also has a library and a research center.
Peshawar Museum,96,History,The Peshawar Museum is a museum in Peshawar Pakistan. It was founded in 1902 and houses a collection of over 100000 artifacts including paintings sculptures and manuscripts. The museum also has a library and a research center.
Museo Nahuizalco,97,Art,A museum of pre-Columbian art and culture.
Museo Casa de la Independencia,97,History,A museum dedicated to the history of Paraguay's independence.
Museo de Arte Sacro,97,Art,A museum of religious art.
Museo Nacional de Bellas Artes,97,Art,A museum of fine art.
Museo de la Inmigración Japonesa,97,Ethnic,A museum dedicated to the history of Japanese immigration to Paraguay.
Museo Nacional de Historia Natural,97,Science,A museum of natural history.
Museo Militar,97,Military,A museum of military history.
Museo Ferroviario,97,Transportation,A museum of railway history.
Asuncion Metropolitan Cathedral,97,Historic House,The Asuncion Metropolitan Cathedral is a cathedral in Asuncion Paraguay. It was founded in 1537 and is the oldest cathedral in Paraguay. The cathedral is a UNESCO World Heritage Site and a symbol of the city's history.
Museo de Arte de Lima,98,Art,A museum of fine art.
Museo de Arte de la Nación,98,Art,A museum of Peruvian art.
Museo de Arte Popular Americano,98,Art,A museum of folk art from the Americas.
Museo de Arte Precolombino,98,Art,A museum of pre-Columbian art.
Museo Larco,98,Art,A museum of pre-Columbian art and gold.
Museo Nacional de Bellas Artes,98,Art,A museum of fine art.
Museo de la Inquisición,98,History,A museum dedicated to the history of the Inquisition in Peru.
Museo de la Policía Nacional del Perú,98,Military,A museum of the Peruvian National Police.
Museo de la Nación Guaraní,98,Ethnic,A museum dedicated to the culture of the Guaraní people.
National Museum of the Philippines,99,History,A museum with a collection of artifacts from the Philippines.
National Museum of Anthropology,99,Ethnic,A museum with a collection of artifacts from the Philippines.
National Museum of Fine Arts,99,Art,A museum with a collection of art from the Philippines.
National Museum of Natural History,99,Science,A museum with a collection of natural history specimens from the Philippines.
Lisbon Oceanário,100,Science,The largest aquarium in Europe.
Museu Nacional de Arte Antiga,100,Art,A museum of Portuguese and European art.
Palácio da Ajuda,100,Historic House,The former royal palace of Portugal.
Museu Nacional dos Coches,100,Transportation,A museum of Portuguese carriages and coaches.
Museu de Arte Popular,100,Ethnic,A museum of Portuguese folk art.
Museu Nacional de Etnologia,100,Ethnic,A museum of the cultures of Africa
Museu da Marioneta,100,Children's,A museum of puppets and marionettes.
San Juan Museum and Library,101,History,A museum with a collection of artifacts from San Juan.
San Juan Fire Museum,101,Firefighting,A museum dedicated to the history of firefighting in San Juan.
San Juan Fun Park,101,Amusement,An amusement park with rides games and food.
State Tretyakov Gallery,102,Art,The State Tretyakov Gallery is an art museum in Moscow
The Pushkin State Museum of Fine Arts,102,Art,The Pushkin State Museum of Fine Arts is an art museum in Moscow
The Hermitage Museum,102,Art,The Hermitage Museum is a museum of art and applied arts in Saint Petersburg
The State Historical Museum of Russia,102,History,The State Historical Museum of Russia is a museum in Moscow
The Kremlin Armoury,102,History,The Kremlin Armoury is a museum in Moscow
The Museum of the History of Religion,102,History,The Museum of the History of Religion is a museum in Moscow
Hermitage Museum,103,Art, A national museum dedicated to the arts and history of the Netherlands
The Ural State Museum of Fine Arts,104,Art,The Ural State Museum of Fine Arts is an art museum in Ekaterinburg
The Museum of Local Lore,104,History,The Museum of Local Lore is a museum in Ekaterinburg
The Museum of the History of Mining,104,History,The Museum of the History of Mining is a museum in Ekaterinburg
The National Museum of Riyadh,105,Art,The National Museum of Riyadh is a museum in Riyadh
The Mada'in Saleh Museum,105,History,The Mada'in Saleh Museum is a museum in Mada'in Saleh
The Royal Saudi Air Force Museum,105,Military,The Royal Saudi Air Force Museum is a museum in Riyadh
The Children's Museum of Riyadh,105,Children's,The Children's Museum of Riyadh is a museum in Riyadh
Jeddah Modern Art Museum,106,Art,A museum of modern and contemporary art in Jeddah Saudi Arabia.
Jeddah Islamic Art Museum,106,Art,A museum of Islamic art in Jeddah Saudi Arabia.
Jeddah Regional Museum,106,History,A museum of the history of Jeddah Saudi Arabia.
Al-Balad Museum,106,Historic House,A museum of the historic district of Al-Balad in Jeddah Saudi Arabia.
Al-Turaif Museum,106,Historic House,A museum of the historic district of Al-Turaif in Jeddah Saudi Arabia.
Singapore Art Museum,107,Art,A museum of modern and contemporary art in Singapore.
National Museum of Singapore,107,History,A museum of the history of Singapore.
Asian Civilisations Museum,107,Ethnic,A museum of the cultures of Asia.
Lee Kong Chian Natural History Museum,107,Science,A museum of natural history in Singapore.
Science Centre Singapore,107,Science,A science museum in Singapore.
Apartheid Museum,108,History,A museum that tells the story of apartheid in South Africa.
Gold Reef City,108,Amusement,A theme park that is set in a gold mining town.
National Museum,108,History,A museum that houses a collection of over 90
South African Museum,108,History,A museum that houses a collection of over 9 million objects
Iziko South African Museum,109,History,A museum that houses a collection of over 9 million objects
Victoria & Alfred Waterfront,109,Amusement,A waterfront complex that is home to shops
Table Mountain,109,Science,A mountain that is located in Cape Town and is one of the most popular tourist destinations in South Africa.
Cape Town Museum,109,History,A museum that houses a collection of over 100
South African Jewish Museum,109,History,A museum that tells the story of the Jewish community in South Africa.
Gyeongbokgung Palace,110,Historic House,The main royal palace of the Joseon dynasty.
National Museum of Korea,110,Art,The largest museum in South Korea.
National Folk Museum of Korea,110,Ethnic,A museum dedicated to the folk culture of Korea.
War Memorial of Korea,110,Military,A museum dedicated to the Korean War.
Seoul Olympic Park,110,Multiple,A park that was built for the 1988 Summer Olympics.
Dongdaemun Design Plaza (DDP),110,Art,A cultural complex that houses museums
Lotte World,110,Amusement,An indoor theme park.
Daejeon Museum of Art,111,Art,A museum of modern and contemporary art in Daejeon South Korea.
Daejeon National Science Museum,111,Science,A science museum in Daejeon South Korea.
Daejeon Railway Museum,111,Transportation,A museum of the history of railways in Daejeon South Korea.
Daegu Art Museum,112,Art,A museum of modern and contemporary art in Daegu South Korea.
Daegu Natural Science Museum,112,Science,A science museum in Daegu South Korea.
Daegu War Memorial,112,Military,A museum of the Korean War in Daegu South Korea.
Barcelona Museum of Contemporary Art,113,Art,A museum of modern and contemporary art in Barcelona Spain.
Barcelona Museum of History,113,History,A museum of the history of Barcelona Spain.
Casa Milà,113,Historic House,A historic house designed by Antoni Gaudí in Barcelona Spain.
Casa Batlló,113,Historic House,A historic house designed by Antoni Gaudí in Barcelona Spain.
Park Güell,113,Botanic Garden,A public park designed by Antoni Gaudí in Barcelona Spain.
Prado Museum,114,Art, A modern museum displaying the archaeological findings of the Acropolis of Athens
Khartoum National Museum,115,History,A museum of the history of Sudan in Khartoum Sudan.
Al-Fateh Islamic Heritage Museum,115,Art,A museum of Islamic art in Khartoum Sudan.
Homs Museum,116,History,A museum of the history of Homs Syria.
Taipei Fine Arts Museum,117,Art,A museum of modern and contemporary art in Taipei Taiwan.
National Palace Museum,117,Art,A museum of Chinese art in Taipei Taiwan.
Bangkok National Museum,118,History,A museum of the history of Thailand in Bangkok Thailand.
Jim Thompson House,118,Historic House,A historic house designed by Jim Thompson in Bangkok Thailand.
Istanbul Archaeology Museums,119,History,A museum complex that houses artifacts from the ancient world.
Topkapi Palace,119,Historic House,The former palace of the Ottoman sultans.
Sultanahmet Mosque,119,History,A mosque that was built in the 17th century.
Blue Mosque,119,History,A mosque that was built in the 17th century.
Grand Bazaar,119,Market,A covered market that is one of the largest in the world.
Dolmabahçe Palace,119,Historic House,The last palace of the Ottoman sultans.
Ankara Museum of Anatolian Civilizations,120,History,A museum of the history of Anatolia in Ankara Turkey.
Adana Archaeology Museum,121,History,The museum houses a collection of artifacts from the region's history including sculptures pottery and jewelry.
Adana Museum of Mosaics,121,Art,The museum houses a collection of mosaics from the Roman and Byzantine periods.
Adana Toy Museum,121,Children's,The museum houses a collection of toys from around the world.
Adana Science and Technology Museum,121,Science,The museum has interactive exhibits on science and technology.
Adana Atatürk Museum,121,History,The museum is dedicated to the life and work of Mustafa Kemal Atatürk the founder of the Republic of Turkey.
British Museum,122,History, One of the world's largest art museums
Buckingham Palace,122,Historic House, A world-renowned institution showcasing over 8 million objects of cultural and historical significance from all continents and periods.
Imperial War Museum,122,Military, The largest and most comprehensive museum of pre-Columbian art and artifacts in the world
British Library,122,Library, A museum dedicated to the study of cultures from around the world
Science Museum,122,Science, One of the largest libraries in the world
Madame Tussauds,122,Wax, A museum dedicated to the history and practice of science
Birmingham Museum and Art Gallery,123,Art,The museum has a collection of art from around the world including paintings sculptures and ceramics.
Birmingham Museum of Natural History,123,Science,The museum has exhibits on natural history including dinosaurs animals and plants.
Cadbury World,123,History,The museum is dedicated to the history of Cadbury the famous chocolate company.
The Barber Institute of Fine Arts,123,Art,The museum has a collection of European paintings sculptures and decorative arts.
The Ikon Gallery,123,Art,The gallery shows contemporary art from around the world.
African American Civil War Memorial Museum,124,Ethnic,History of the African American soldiers and sailors who fought for the Union in the United States Civil War
American University Museum,124,Art,"Regional, national, and international contemporary art"
Anacostia Community Museum,124,Ethnic,Local history and culture
Anderson House,124,Historic house,"Early 1900s palatial residence with period furnishings, Society artifacts, portraits, armaments, and personal artifacts of Revolutionary War soldiers"
Art Museum of the Americas,124,Art,Museum for modern and contemporary Latin American and Caribbean art
Arts and Industries Building,124,Science,A national space to explore ideas and questions about the future
Arthur M. Sackler Gallery,124,Art,"Include Chinese, Indian, Korean and Japanese paintings, photography, contemporary ceramics from China, 19th- and 20th-century Japanese prints, contemporary Japanese pottery, Persian and Islamic paintings and manuscripts"
Charles Sumner School,124,History,One of the first public school buildings erected for the education of Washington's black community
Chinese American Museum DC,124,History,A new museum focused on the history
Clara Barton Missing Soldiers Office Museum,124,History,Apartment where Clara Barton lived throughout the Civil War that was her home base for her work as the angel of the battlefield. After the war
DAR Museum,124,Art,"Features 30 period rooms of decorative arts including furniture, silver, paintings, ceramics, textiles, toys, quilts"
Decatur House,124,Historic house,Early 19th-century house with exhibits about the White House. Currently closed for tours.
Dumbarton House,124,Historic house,Early 19th century period house and headquarters
Dumbarton Oaks Research Library and Collection,124,Library,Exhibits of Byzantine and Pre-Columbian art and European masterpieces from its collections
Folger Shakespeare Library,124,Library,Exhibits from its collections about William Shakespeare
Ford's Theatre National Historic Site,124,History,"Site of assassination of President Abraham Lincoln, includes theater presentation, Lincoln museum, and Petersen House where he was taken"
Freer Gallery of Art,124,Art,"Asian art including East Asia, South Asia, Southeast Asia, the Islamic world, the ancient Near East, and ancient Egypt, as well as a significant collection of American art"
Frederick Douglass National Historic Site,124,Historic house,"Home and estate of Frederick Douglass, one of the most prominent African Americans of the 19th century"
General Federation of Women's Clubs Headquarters,124,Historic house,"Tours of the social clubhouse headquarters, changing exhibits of art, photographs and artifacts from its collections"
George Washington University Art Galleries,124,Art,"Two galleries, includes painting, sculpture, and photographs, ranging from rare historic pieces to Washingtoniana and Americana to modern art"
Georgetown University Art Galleries,124,Art,Located in the Walsh building and around the Georgetown campus
German-American Heritage Museum of the USA,124,Ethnic,"German-American history and culture, housed in a Victorian townhouse"
Heurich House Museum,124,Historic house,Gilded Age mansion with early household innovations
"Hillwood Estate, Museum & Gardens",124,Art,"Estate and gardens of Marjorie Merriweather Post, rooms decorated with her collections of 18th- and 19th-century French art, china and art treasures from Imperial Russia"
Hirshhorn Museum and Sculpture Garden,124,Art,Contemporary and modern art
"Historical Society of Washington, D.C.",124,Library,Exhibits of the city's history from its collections
Howard University Gallery of Art,124,Art,"Located in Childers Hall, home of the Fine Arts Division of the College of Arts and Sciences"
Interior Museum,124,History,"Activities of the agencies of the United States Department of the Interior, including the National Park Service, Bureau of Indian Affairs, Bureau of Land Management, Bureau of Reclamation, United States Fish and Wildlife Service and United States Geological Survey"
International Spy Museum,124,History,"Espionage history, artifacts, famous figures"
Kreeger Museum,124,Art,"19th- and 20th-century paintings and sculptures by internationally known artists, works by local Washington artists, traditional west and central African art"
Laogai Museum,124,History,This museum confronts the tragic legacy of China's Laogai system of forced labor prisons.
L. Ron Hubbard House,124,Historic house,Residence of Scientology founder L. Ron Hubbard from 1955 until 1959
Library of Congress,124,Library,"Exhibits from its collections in American history, culture and art"
Lillian & Albert Small Jewish Museum,124,History,"History of the local Jewish community; preserves the oldest synagogue building in the Washington, D.C., area; operated by the Jewish Historical Society of Greater Washington"
Lincoln Memorial,124,History,Includes displays about the building of the Memorial and some of Lincoln's phrases
Madame Tussauds Washington D.C.,124,Wax,"Wax figures of media celebrities, Presidents, political figures, historical figures, sports stars and more"
Mary McLeod Bethune Council House National Historic Site,124,Historic house,Home of educator and civil rights leader Mary McLeod Bethune
Meridian House,124,Art,"Exhibitions of paintings, photographs, sculptures, videos, and crafts that reflect various aspects of American culture to encourage foreign understanding"
Museum of the Bible,124,History,"https://www.museumofthebible.org/.  Documents the narrative, history and impact of the Bible."
National Air and Space Museum,124,Science,"History and science of aviation and spaceflight, as well as planetary science and terrestrial geology and geophysics"
National Archives,124,History,"Exhibits from its collections including the Declaration of Independence, the Constitution, the Bill of Rights, and a copy of the 1297 Magna Carta confirmed by Edward I"
National Bonsai and Penjing Museum,124,History,"Located on the campus of the United States National Arboretum, Bonsai and Penjing botanical specimens and displays"
National Building Museum,124,Art,"Exhibits about architecture, design, engineering, construction, and urban planning"
National Children's Museum,124,Children's,"Serves children up to age 12 and their families through interactive exhibits exploring science, technology, engineering, art, and math."
National Deaf Life Museum,124,History,Permanent and rotating exhibits chronicling deaf culture and history
National Gallery of Art,124,Art,"Paintings, drawings, prints, photographs, sculpture, medals, and decorative arts that trace the development of Western Art from the Middle Ages to the present"
National Geographic Museum,124,History,"Operated by the National Geographic Society, changing exhibits of photography, natural history, culture and history"
National Guard Memorial Museum,124,Military,History of the National Guard of the United States from the Revolutionary War era to post-9/11 era
National Law Enforcement Museum,124,History,Dedicated to telling the story of American law enforcement by providing visitors a â€œwalk in the shoesâ€ experience. The interactive exhibits and insightful programs are intended to expand and enrich the relationship shared by law enforcement and the community.
National Museum of African American History and Culture,124,Ethnic,"National museum devoted to the documentation of African American life, history, and culture. Opened September 24, 2016."
National Museum of African Art,124,Art,"African art and culture, includes paintings, musical instruments, sculpture, jewelry, regalia, textiles, pottery"
National Museum of American History,124,History,"American social, political, cultural, scientific and military history"
National Museum of the American Indian,124,Ethnic,"Life, languages, literature, history and arts of the Native Americans of the Western Hemisphere"
National Museum of American Jewish Military History,124,History,Jewish Americans who served in the armed forces
