National Museum of Natural History,124,History,"Galleries include paleontology, geology, mammals, human origins, insects, ocean life, gems and minerals, Western, African and Korean cultures"
National Museum of Women in the Arts,124,Art,"Women's achievements in the visual, performing and literary arts"
National Portrait Gallery,124,History,Images and history of famous individual Americans
National Postal Museum,124,History,History of the United States Postal Service and of mail service around the world
The Octagon House,124,Historic house,Early 19th-century townhouse
Old Korean Legation Museum,124,Historic house,Late 19th-century townhouse that served as the Korean legation from 1889 to 1905.
Old Stone House,124,Historic house,"Mid 18th century period house, the oldest unchanged building in Washington, D.C."
O Street Museum Foundation,124,Art,"The collection rotates and changes daily and includes art, music, architecture, memorabilia, manuscripts, sculpture and other items that promote exploration of the creative process."
The Phillips Collection,124,Art,American and European impressionist and modern art
Planet Word,124,Art,Language and words
President Lincoln's Cottage at the Soldiers' Home,124,Historic house,Cottage retreat of President Abraham Lincoln and other Presidents
Renwick Gallery,124,Art,American craft and decorative arts from the 19th century to the 21st century
Rubell Museum DC,124,Art,"Washington, D.C. satellite of the Miami-based Rubell Museum"
Saint John Paul II National Shrine,124,History,Life and papacy of Pope John Paul II and the history of Catholic heritage in North America
Salve Regina Gallery,124,Art,Part of Catholic University of America
House of the Temple,124,History,"Masonic principles of personal, social and intellectual freedom, artifacts of American history, Masonic regalia and memorabilia"
S. Dillon Ripley Center,124,History,"Exhibits of art, photography"
Belmontâ€“Paul Women's Equality National Monument,124,History,U.S. women's suffrage and equal-rights movements
Smithsonian American Art Museum,124,Art,American art that covers all regions and art movements found in the United States
Textile Museum,124,History,"Textiles from around the world including rugs, clothing, located at George Washington University"
Tudor Place,124,Historic house,"Mansion with European and American decorative arts including American silver, porcelain, furniture, glassware, sculpture, portraits, prints, and textiles"
United States Capitol,124,History,Tours of the building
United States Capitol Visitor Center,124,History,History of the U.S. Capitol and Congress
United States Holocaust Memorial Museum,124,History,History of the Holocaust in Europe
National Museum of the United States Navy,124,Military,"History of the U.S. Navy from the American Revolution to the present, naval artifacts, models, documents and fine art"
Washington Monument,124,History,NULL
White House,124,Historic house,"Official state residence of the president of the United States, tours by advance reservation"
The Wilderness Society Gallery,124,Art,"Exhibits from its collections, including photos by Ansel Adams"
Woman's National Democratic Club Museum,124,Historic house,"website, political memorabilia, artwork, and photographs in the Whittemore House"
Woodrow Wilson House,124,Historic house,Home of President Woodrow Wilson after he left office
African Burial Ground National Monument,125,History,Visitor center and memorial to an 18th-century African-American slave burial ground
A.I.R. Gallery,125,Art,Contemporary art by female artists
Alice Austen House,125,Historic house,"Home of photographer Alice Austen, also features photography exhibitions"
American Academy of Arts and Letters,125,Art,"Exhibitions of its members in American literature, music, and art, also recreated studio of composer Charles Ives"
American Folk Art Museum,125,Art,American folk art
American Museum of Natural History,125,History,The world's largest natural history museum. Includes Rose Center for Earth and Space
American Numismatic Society Museum,125,Culture,Exhibits of coins and medals from all periods and cultures
Americas Society,125,Art,"Exhibits of historic and contemporary art from Latin America, the Caribbean, and Canada"
Aperture Foundation,125,Media,Exhibitions dedicated to contemporary and classic photography
Artists Space,125,Art,Non-profit contemporary art gallery
Asia Society,125,Art,Features historic and contemporary Asian art and decorative items
Austrian Cultural Forum New York,125,Culture,Culture center with art exhibition gallery
Bard Graduate Center,125,Art,"Annually organizes two to three exhibitions related to decorative arts, architecture, and design"
Bartow-Pell Mansion,125,Historic house,Mid-19th-century period mansion and gardens
Bayside Historical Society,125,History,Located in the Officer's Club in Fort Totten
Bernard Museum of Judaica,125,Ethnic,"Located in Temple Emanu-El, Jewish art, religious ornaments, and Temple memorabilia"
Billiou-Stillwell-Perine House,125,Historic house,"17th-century Dutch colonial house, operated by Historic Richmond Town"
Brooklyn Navy Yard Center at BLDG 92,125,Multiple,"website, history of the former Navy yard, tours, plans for its future, exhibits of local art, photography, history"
Bowne House,125,Historic house,"Oldest house in Queens, dates back to the mid-1600s"
BRIC House,125,Art,Contemporary art and new media
Bronx Children's Museum,125,Children's,
Bronx Museum of the Arts,125,Art,Focuses on contemporary and 20th-century art
Bronx River Art Center,125,Art,website
Brooklyn Botanic Garden,125,Botanic Garden,Includes a bonsai museum and art gallery in the conservatory
Brooklyn Children's Museum,125,Children's,
Brooklyn Museum,125,Art,"Collections include American art, Egyptian, Classical, and Ancient Near Eastern art, feminist, European, and art of the Pacific Islands"
Castle Clinton National Monument,125,History,"Fort that contains a museum that is administered by the National Park Service, and is a departure point for visitors to the Statue of Liberty and Ellis Island"
Center for Architecture,125,Art,"Exhibits of architecture, urban planning, urban design, and environmental planning"
Center for Art and Culture of Bedford-Stuyvesant,125,Art,"website, cultural and performing arts center with the Skylight Gallery for visual art"
Center for Brooklyn History,125,History,History and culture of Brooklyn
Center for Jewish History,125,Ethnic,Jewish history and culture around the world
Chaim Gross Studio Museum,125,Art,"Operated by the Renee and Chaim Gross Foundation, home and studio of sculptor Chaim Gross"
Children's Museum of Manhattan,125,Children's,
China Institute,125,Art,"Galleries with exhibits about traditional Chinese paintings, calligraphy, Chinese folk arts, textiles, and architecture"
City Island Nautical Museum,125,History,"Operated by the City Island Historical Society, local history, maritime heritage"
City Reliquary,125,History,Memorabilia and artifacts about New York City
Clemente Soto Velez Cultural and Educational Center,125,Culture,Cultivates Latino culture and acts as a hub for visual and performing arts on the Lower East Side
The Cloisters,125,Art,"Art and architecture of the European Middle Ages, branch of the Metropolitan Museum of Art"
Columbia University Rare Book & Manuscript Library,125,Library,Two galleries with free exhibitions from the collections
Coney Island Museum,125,Amusement,"History of Coney Island's amusement park, beach, and neighborhood"
Conference House,125,Historic house,Only pre-Revolutionary manor house still surviving in New York City
"Cooper Hewitt, Smithsonian Design Museum",125,Art,"Part of the Smithsonian, decorative arts and design"
Cooper Union Galleries,125,Art,"Several galleries with works by students, faculty and guest artists in art, architecture, design, photography"
Czech Centre New York,125,Culture,"website, exhibits of Czech artists, located in Bohemian National Hall"
Derfner Judaica Museum,125,Ethnic,Includes the Art Collection at The Hebrew Home at Riverdale
Dia:Chelsea,125,Art,
Drawing Center,125,Art,Contemporary and historical drawings
Dyckman Farmhouse Museum,125,Historic house,Late 18th-century farmhouse; the oldest remaining farmhouse on Manhattan island
Edgar Allan Poe Cottage,125,Historic house,1840s house where author Edgar Allan Poe lived
El Museo del Barrio,125,Art,"Latin American and Caribbean art, with an emphasis on works from Puerto Rico and the Puerto Rican community in New York City"
Ellis Island Museum,125,History,"Tours by boat from Battery Park in Manhattan or Liberty State Park in Jersey City, New Jersey, immigration experience and history of the immigrants"
Federal Hall National Memorial,125,History,Site of first capitol of the United States of America and of George Washington's first inauguration in 1789
FDNY Fire Zone,125,Firefighting,"website, fire safety learning center operated by the FDNY, located in Rockefeller Center"
"Fordham Museum of Greek, Etruscan and Roman Art",125,Art,Collection of ancient antiquities in William D. Walsh Family Library of Fordham University
Fort Totten,125,Military,Tours of the Civil War-era fort
Fort Wadsworth,125,Military,Exhibits and tours of the mid-19th-century fort
Fraunces Tavern,125,History,Reconstruction of a tavern with a prominent role in pre-Revolution and American Revolution history
Frick Collection,125,Art,Mansion with collection of old master paintings and fine furniture
Gallery Korea,125,Art,"Part of the Korean Cultural Service, contemporary Korean art"
Garibaldi-Meucci Museum,125,Ethnic,"Home of Italian politician Giuseppe Garibaldi and inventor Antonio Meucci, celebrates Italian American culture and heritage"
George Gustav Heye Center,125,Ethnic,"Part of the Smithsonian, Native American history, culture, and art"
General Grant National Memorial,125,History,"Mausoleum of General Ulysses Grant and his wife, displays about his life and Presidency"
Godwin-Ternbach Museum,125,Art,"Part of Queens College, City University of New York, collection includes painting, sculpture and decorative arts, prints and drawings, and ethnographic arts from all periods and cultures, Western and non-Western"
Governors Island National Monument,125,Military,"Includes tours of Castle Williams, an 1807 fort and prison, and Fort Jay, a coastal star fort; open seasonally"
Gracie Mansion,125,Historic house,Official residence of the Mayor of New York City
Greater Astoria Historical Society,125,History,Local history
Green-Wood Cemetery,125,History,"Exhibits of history related to people buried in the historic cemetery, themed tours"
Grey Art Gallery,125,Art,"Part of New York University, emphasizes art's historical, cultural, and social context"
Grolier Club,125,Library,Public exhibitions from its book and literary collections
Ground Zero Museum Workshop,125,History,"website, history of the September 11 attacks and the workers at the World Trade Center site"
Guggenheim Museum,125,Art,"Designed by Frank Lloyd Wright, Impressionist, Post-Impressionist, early Modern, and contemporary art"
Hall of Fame for Great Americans,125,History,"Part of Bronx Community College, National Landmark founded as a pantheon honoring historically significant American men and women"
Hamilton Grange National Memorial,125,Historic house,Relocated early 19th-century home of Alexander Hamilton
Harbor Defense Museum,125,Military,"Located in Fort Hamilton, 19th-century fort with exhibits of NY military history"
Hebrew Union College-Jewish Institute of Religion Museum,125,Ethnic,"website, part of Hebrew Union College, art exploring Jewish identity, history, culture, and experience"
Hispanic Society of America,125,Art,"Spanish, Portuguese, and Latin American art and artifacts"
Historic Richmond Town,125,History,Over 30 historic buildings and sites dating from the late 17th to the early 20th century; includes the Lake-Tysen House and Voorlezer's House
Hostos Center for the Arts & Culture,125,Art,The Longwood Art Gallery at Hostos presents a seasonal showcase of different Latin American artists
International Center of Photography,125,Art,Photography exhibits - moving to Lower Manhattan in 2016
International Print Center New York,125,Art,Exhibition and understanding of fine art prints
"Intrepid Sea, Air & Space Museum",125,Military,"Showcases the World War II aircraft carrier USS Intrepid, Space Shuttle Enterprise, submarine USS Growler, a Concorde supersonic airplane, helicopters and military aircraft"
Jacques Marchais Museum of Tibetan Art,125,Art,Art and artifacts of the Himalayas
Jamaica Center for Arts & Learning,125,Art,Cultural center with art gallery
Japan Society,125,Culture,Features exhibit gallery for Japanese art
Jewish Children's Museum,125,Children's,"Jewish heritage, fostering tolerance and understanding"
Jewish Museum,125,Ethnic,"Modern and contemporary Jewish art, history"
Jewish Theological Seminary Library Galleries,125,Ethnic,"website, free exhibitions from the library's collections of Jewish heritage"
John J. Harvey,125,Maritime,"Fireboat under restoration, offers occasional public tours and rides"
King Manor,125,Historic house,"Early 19th-century period home of Rufus King, a signer of the United States Constitution"
Kingsland Homestead,125,Historic house,"Member of the Historic House Trust, operated by the Queens Historical Society, Victorian period house, local history exhibits"
Korea Society,125,Art,Cultural society with gallery of Korean art and culture
Lefferts Historic House,125,Historic house,"Located in Prospect Park, 1820s period house"
Lehman College Art Gallery,125,Art,"website, part of Lehman College"
Leslie-Lohman Museum of Gay and Lesbian Art,125,Art,Contemporary and historical gay-related art
Lewis H. Latimer House,125,Historic house,Home of African American inventor Lewis H. Latimer
The Living Museum,125,Art,"Part of Creedmoor Psychiatric Center,  art dedicated to, and created by individuals with a mental illness"
Living Torah Museum,125,Ethnic,"Ancient artifacts mentioned in the Torah, items from the Biblical period"
Louis Armstrong House,125,Historic house,Home of musician Louis Armstrong
Lower East Side Tenement Museum,125,Historic house,Immigrant experience
Madame Tussauds New York,125,Wax,Famous figures in entertainment
Maritime Industry Museum,125,Maritime,"Located in Fort Schuyler, history of the US maritime industry including commercial shipping, the merchant marine, and the port of New York"
Merchant's House Museum,125,Historic house,19th-century family town home
Metropolitan Museum of Art,125,Art,"One of the world's largest and most visited art museums, includes American art and decorative arts, European, African, Asian, Ancient Egyptian, Roman and Greek art, Byzantine and Islamic art, modern art"
Mets Hall of Fame & Museum,125,Sports,"Located at Citi Field, New York Mets baseball history"
Miriam and Ira D. Wallach Art Gallery,125,Art,"website, part of Columbia University"
Mmuseumm,125,Art,Contemporary vernacular design from around the world
MoCADA: Museum of Contemporary African Diasporan Arts,125,Art,Art focusing on social and political issues facing the African Diaspora
MoMA PS1,125,Art,"Contemporary art museum, part of Museum of Modern Art"
The Morgan Library & Museum,125,Art,"Includes books and printed materials, prints, and drawings of European artists, material from ancient Egypt and medieval liturgical objects, ancient Near Eastern cylinder seals, music manuscripts"
Morris-Jumel Mansion,125,Historic house,18th-century period mansion used as headquarters for both sides in the American Revolution
Mount Vernon Hotel Museum,125,Historic house,Early 19th period-century hotel
Museum at Eldridge Street,125,Ethnic,American Jewish history and culture in a restored historic synagogue
Museum at FIT,125,History,"Fashion museum, part of Fashion Institute of Technology"
Museum of American Finance,125,History,"Financial markets, money, banking, entrepreneurship, and Alexander Hamilton"
Museum of American Illustration,125,Art,"Part of the Society of Illustrators, American illustration"
Museum of Arts and Design,125,Art,"Features contemporary hand-made objects in a variety of media, including clay, glass, metal, fiber, and wood, located at Columbus Circle"
Museum of Chinese in America,125,Ethnic,History of North America's Chinatowns and the cultural contributions of Chinese immigrants
Museum of Jewish Heritage,125,Ethnic,Modern Jewish history and the Holocaust
Museum of Mathematics,125,Science,Interactive exhibits about mathematics
Museum of Modern Art (MoMA),125,Art,"Modern art including architecture and design, drawings, painting, sculpture, photography, prints, illustrated books and artist's books, film, and electronic media"
Museum of Public Relations,125,Media,"website, a public relations museum and reference library, part of Baruch College’s Newman Library Archives and Special Collections, open to the public by appointment for tours, guest lectures and research"
Museum of Reclaimed Urban Space,125,History,History of grassroots urban space activism
Museum of Sex,125,Sex,"History, evolution, and cultural significance of human sexuality"
Museum of the City of New York,125,Multiple,Art and local history
Museum of the Moving Image,125,Media,"Exhibitions and programs dedicated to the art, history, technique, and technology of film, television, digital media, video games, the internet, and more."
National Academy Museum and School,125,Art,Exhibits of art and architecture from its collections
National Lighthouse Museum,125,Maritime,Dedicated to the history of lighthouses and their keepers
National September 11 Memorial & Museum,125,History,Memorial and museum dedicated to victims of 9/11 attacks
National Jazz Museum in Harlem,125,Music,Harlem's jazz history
National Track and Field Hall of Fame,125,Sports,Operated by The Armory Foundation in conjunction with USA Track & Field
New Africa Center,125,Art,"African art and culture, not open yet, building new facility on Museum Mile, formerly known as Museum for African Art"
Neue Galerie,125,Art,Gallery of early-20th-century German and Austrian art and design
Newhouse Center for Contemporary Art,125,Art,"Part of Snug Harbor Cultural Center, contemporary art"
New Museum,125,Art,Contemporary art from around the world
New York Botanical Garden,125,Botanic Garden,Includes Mertz Library with exhibitions relating to botanical themes and the Enid A. Haupt Conservatory
New York Earth Room,125,Art,Permanent exhibit of earth covered room
New York Hall of Science,125,Science,"Topics include biology, chemistry and physics"
New-York Historical Society,125,History,History of New York and the United States
New York City Fire Museum,125,Firefighting,"Historical and modern firefighting vehicles, equipment, uniforms"
New York Public Library Main Branch,125,Multiple,"Exhibitions about art, history, culture, photography from its collections"
New York Public Library for the Performing Arts,125,Art,"Exhibitions about the performing arts, located at Lincoln Center for the Performing Arts"
New York School of Interior Design Gallery,125,Art,"website, free gallery with exhibits about interior design"
New York Transit Museum,125,Transportation,"Subways, trolleys, and buses"
New York Transit Museum,125,Transportation,"Subway and train system of NY, located in Grand Central Terminal"
New York Yankees Museum,125,Sports,"Located in Yankee Stadium, history and memorabilia of the New York Yankees"
Nicholas Roerich Museum,125,Art,Works by Nicholas Roerich
Noble Maritime Collection,125,Maritime,"Part of Snug Harbor Cultural Center, houseboat and artist studio"
Noguchi Museum,125,Art,Works by sculptor Isamu Noguchi
Old Stone House,125,Historic house,"Reconstructed 1699 Dutch stone farmhouse with Revolutionary War ties, focuses on evolving histories of Brooklyn, New York and the United States"
Paley Center for Media,125,Media,"Cultural, creative and social significance of television, radio, the Internet, and emerging media platforms"
Park Avenue Armory,125,Art,Presents art exhibitions
Parsons The New School for Design Gallery,125,Art,Exhibits of art and design in the Sheila C. Johnson Design Center
Peter Fingesten Gallery,125,Art,"website, operated by Pace University at 1 Pace Plaza"
Poster House,125,Art,"website, first museum in the United States dedicated exclusively to posters"
Queens College Art Center,125,Art,"website, part of Queens College"
Queens County Farm Museum,125,History,Working farm dating back to 1697
Queens Museum,125,Art,"Focus on social practice, artist in residence programs, and education. Includes a collection of Tiffany glass and the Panorama of the City of New York."
Rose Museum,125,Music,Chronicles the history Carnegie Hall from the collections of its archives
Rubin Museum of Art,125,Art,Art of the Himalayas and surrounding regions
Salmagundi Museum of American Art,125,Art,website American representational art from 1840s to today run by the Salmagundi Club
Sandy Ground Historical Museum,125,History,"Operated by the Sandy Ground Historical Society, community and Staten Island's African-American culture and history"
Scandinavia House – The Nordic Center in America,125,Culture,"Art, design, and historical exhibitions of the Nordic countries"
Schomburg Center for Research in Black Culture,125,Ethnic,"Branch of the New York Public Library, exhibits of African American history, culture"
SculptureCenter,125,Art,Dedicated to experimental and innovative developments in contemporary sculpture
Seguine Mansion,125,Historic house,Mid-19th-century mansion
Skyscraper Museum,125,Art,Currently the only museum in the world dedicated to skyscrapers
Socrates Sculpture Park,125,Art,Outdoor museum and public park where artists can create and exhibit sculptures and multi-media installations
South Street Seaport Museum,125,Maritime,"Includes exhibition galleries, a working 19th-century print shop, an archeology museum and several historic museum ships including the four-masted Peking"
Staten Island Children's Museum,125,Children's,Part of Snug Harbor Cultural Center
Staten Island Museum,125,Multiple,"Natural history, art, history, science, part of Snug Harbor Cultural Center"
Statue of Liberty,125,History,"Accessible by boat from Battery Park in Manhattan and Liberty State Park in Jersey City, New Jersey"
Studio Museum in Harlem,125,Art,"Art of African-Americans, specializing in 19th- and 20th-century work as well as exhibits of Caribbean and African art"
Sugar Hill Children's Museum of Art & Storytelling,125,Children's,
Swiss Institute Contemporary Art New York,125,Art,Contemporary art
Terrain Gallery,125,Art,"Exhibits of contemporary paintings, prints, drawings, and photographs"
The Shed,125,Art,"Hosts activities in a wide range of cultural areas including art, performance, film, design, food, fashion, and new combinations of cultural content"
Theodore Roosevelt Birthplace National Historic Site,125,Historic house,Recreated 1865 period brownstone home where Theodore Roosevelt lived as a child
Tibet House US,125,Art,Classical and contemporary Tibetan art
Trinity Church,125,History,"History of the church, changing art, religious and cultural exhibits"
Ukrainian Institute of America,125,Art,Features exhibits of notable Ukrainian artists living in the states and other events related to Ukrainian heritage
Ukrainian Museum,125,Ethnic,Ukrainian heritage in America including folk art and fine art
United Nations Headquarters,125,Historic house,"Includes exhibits on such topics as peacekeeping operations, decolonization and disarmament, and the United Nations Art Collection"
Valentine Museum of Art,125,Art,Museum dedicated to living artists and their work
Valentine Museum of Art at Medgar Evers College,125,Art,"Museum extension within Medgar Evers College, CUNY"
Valentine-Varian House,125,Historic house,"Houses the Museum of Bronx History, operated by the Bronx County Historical Society"
Van Cortlandt House Museum,125,Historic house,18th-century period manor house
Vander Ende-Onderdonk House,125,Historic house,"Oldest Dutch Colonial stone house in New York City, operated by the Greater Ridgewood Historical Society"
Voelker Orth Museum,125,Historic house,"German immigrant family’s 1890s home and garden, exhibits of cultural and horticultural heritage of Flushing, Queens and adjacent communities"
Waterfront Museum,125,Maritime,"website, historic floating barge museum in Red Hook"
Wave Hill,125,Botanic Garden,Botanical garden with art gallery and interpretive visitor's center
Weeksville Heritage Center,125,History,"History of the 19th-century African American community of Weeksville, Brooklyn - one of America’s first free black communities"
White Columns,125,Art,Alternative art gallery
Whitney Museum of American Art,125,Art,20th-century American art and contemporary American art by living artists
Williamsburg Art & Historical Center,125,Art,"Art exhibitions, performances and cultural events"
Wyckoff House,125,Historic house,Dutch saltbox frame house dating back to 1652
Yeshiva University Museum,125,Ethnic,"Also an archaeology, history, and art museum focused on Jewish subjects"
Art Institute of Chicago,126,Art,One of the largest and most comprehensive art museums in the world
Field Museum,126,History,A world-renowned natural history museum with a vast collection of fossils
Shedd Aquarium,126,Science,A leading aquarium with over 32
Museum of Science and Industry,126,Science,A hands-on science museum with over 450 interactive exhibits
Museum of Contemporary Art,126,Art,A museum dedicated to showcasing the most cutting-edge contemporary art from around the world.
DuSable Museum of African American History,126,History,A museum dedicated to preserving and sharing the history and culture of African Americans.
The Peggy Notebaert Nature Museum,126,History,A natural history museum with a focus on the natural history of the Midwest.
