Coq au vin,1,15,A classic French dish of braised chicken in red wine sauce.
Boeuf bourguignon,1,20,Another classic French dish of beef stew in red wine sauce.
Soupe à l'oignon gratinée,1,10,A French onion soup topped with Gruyère cheese and baked until golden brown.
Tagine de kefta,2,15,A Moroccan dish of spiced meatballs in a slow-cooked tomato sauce.
Couscous royal,2,20,A traditional Moroccan dish of couscous with lamb vegetables and raisins.
Bisteeya,2,20,A flaky pastry filled with minced meat almonds and spices.
Beignets,3,10,French doughnuts served with powdered sugar.
Crêpes Suzette,3,15,Thin pancakes flambéed with orange liqueur and Grand Marnier.
Profiteroles,3,20,Creamy choux pastry filled with ice cream and topped with chocolate sauce.
Bacalhau à Brás,4,20,Portuguese cod dish with potatoes onions and eggs
Arroz de Pato,4,18,Portuguese rice dish with duck sausage and vegetables
Costeleta de Porco à Alentejana,4,25,Portuguese pork chop dish with clams garlic and parsley
Moqueca Capixaba,5,22,Brazilian fish stew with coconut milk tomatoes and onions
Feijoada Completa,5,20,Brazilian black bean stew with rice sausage and pork
Vatapá,5,18,Brazilian seafood stew with bread coconut milk and peanuts
Porterhouse Steak,6,50,Grilled New York strip steak
Filet Mignon,6,40,Grilled beef tenderloin
Ribeye Steak,6,35,Grilled rib steak
Lobster Bisque,7,15,Creamy lobster soup
Caesar Salad,7,10,Classic Caesar salad with romaine lettuce croutons and Parmesan cheese
Filet Mignon with Lobster Mashed Potatoes,7,50,Grilled beef tenderloin with lobster mashed potatoes
Lobster Risotto,8,25,Risotto with lobster saffron and white wine
Veal Scaloppine,8,30,Seared veal scallops with lemon butter sauce
Filet Mignon with Truffle Butter,8,40,Grilled beef tenderloin with truffle butter
Pan-Seared Scallops,9,35,Pan-seared sea scallops with lemon butter sauce
Seared Ahi Tuna,9,28,Seared ahi tuna with soy glaze and wasabi
Grilled Salmon,9,25,Grilled salmon with lemon and dill
Seafood Tower,10,50,Assortment of fresh seafood including shrimp lobster crab and oysters
Cioppino,10,30,Seafood stew with tomatoes garlic and herbs
Fish and Chips,10,15,Fried fish and french fries
Wiener Schnitzel,11,15,Thinly pounded veal cutlet coated in breadcrumbs and deep-fried.
Schweinsbraten,11,20,Roasted pork shoulder served with sauerkraut and dumplings.
Knödel,11,10,Dumplings made from bread potatoes or flour.
Beef Brisket,12,25,Slow-cooked beef brisket served with mashed potatoes and gravy.
Smoked Turkey Legs,12,15,Smoked turkey legs served with your choice of sides.
Macaroni & Cheese,12,12,Macaroni and cheese with a creamy cheddar cheese sauce.
Wiener Schnitzel,13,15,Thinly pounded veal cutlet coated in breadcrumbs and deep-fried.
Käsespätzle,13,12,Spätzle with melted cheese and onions.
Apfelstrudel,13,10,Apple strudel with vanilla sauce.
Beef Goulash,14,20,Beef stew with paprika onions and tomatoes.
Wiener Schnitzel,14,15,Thinly pounded veal cutlet coated in breadcrumbs and deep-fried.
Nockerln,14,10,Austrian dessert dumplings made with flour eggs and sugar.
Chicken Caesar Salad,15,15,Romaine lettuce croutons Parmesan cheese and grilled chicken breast tossed in a Caesar dressing.
Filet Mignon,15,30,6-ounce grilled filet mignon served with your choice of sides.
New York Strip Steak,15,25,8-ounce grilled New York strip steak served with your choice of sides.
Plov,16,15,Uzbek rice pilaf with meat vegetables and spices.
Lagman,16,12,Noodle soup with meat vegetables and spices.
Manty,16,10,Steamed dumplings filled with meat and onions.
Meze Platter,17,20,Selection of small plates such as hummus baba ganoush falafel and phyllo pastries.
Grilled Lamb Chops,17,25,Grilled lamb chops served with rice and vegetables.
Chicken Shawarma,17,15,Chicken shawarma served in a pita with hummus tahini and vegetables.
Beef Stroganoff,18,25,Seared beef tenderloin in a creamy stroganoff sauce with mushrooms onions and sour cream.
Osetra Caviar,18,150,Imperial Osetra caviar from the Caspian Sea served on blini with sour cream and chopped egg.
Caviar Pizza,18,20,Pizza topped with caviar cream cheese and dill.
Chicken Manchurian,19,15,Chicken in a sweet and sour sauce with vegetables.
Hakka Noodles,19,10,Noodles in a spicy sauce with vegetables and chicken.
Fried Rice,19,12,Fried rice with vegetables and chicken.
Chicken Biryani,20,18,Chicken cooked in a rice dish with spices.
Mutton Biryani,20,20,Mutton cooked in a rice dish with spices.
Vegetable Biryani,20,15,Vegetables cooked in a rice dish with spices.
Falafel,21,10,Deep-fried balls made of chickpeas herbs and spices.
Hummus,21,8,Chickpeas blended with tahini lemon juice and garlic.
Shawarma,21,12,Grilled meat served in a pita with vegetables and tahini sauce.
Barbacoa Tacos,22,10,Tacos filled with shredded beef barbacoa onions cilantro and salsa.
Al pastor Tacos,22,10,Tacos filled with pork al pastor onions cilantro and salsa.
Asada Tacos,22,10,Tacos filled with grilled steak onions cilantro and salsa.
Vinho Verde,23,12,A light refreshing Portuguese wine.
Port Wine,23,20,A sweet fortified Portuguese wine.
Ginjinha,23,5,A Portuguese liqueur made from sour cherries.
Feijoada,24,15,A Brazilian stew made with black beans sausage and pork.
Moqueca,24,20,A Brazilian fish stew made with coconut milk tomatoes and onions.
Arroz Carreteiro,24,12,A Brazilian rice dish made with beef bacon and onions.
Tiramisu,25,10,An Italian dessert made with coffee-soaked ladyfingers mascarpone cheese and chocolate.
Cannoli,25,8,An Italian pastry filled with ricotta cheese chocolate chips and candied fruit.
Gelato,25,6,An Italian ice cream made with fresh fruit and milk.
Vatapa,26,25,Creamy shrimp and crab stew with bread peanuts and coconut milk
Pica Pau,26,20,Shrimp and pork skewers served with farofa (toasted manioc flour) and vinaigrette
Carne de Sol,26,25,Dried salted beef that is shredded and served with a variety of accompaniments
Moqueca de Camarão,27,30,Spicy shrimp stew served with rice and farofa
Cuscuz Marroquino,27,25,Moroccan couscous with chickpeas raisins and almonds
Carne de Panela,27,20,Stewed beef with tomatoes onions and garlic
Sarapatel,28,25,Tripe stew with tomatoes onions and peppers
Bife à Cavalo,28,20,Steak with fried eggs and onions
Feijoada,28,25,Black bean stew with sausage bacon and beef
Picanha,29,30,Grilled sirloin tip
Filé Mignon,29,25,Grilled tenderloin steak
Costela,29,20,Barbecued ribs
Galeto Assado,30,25,Roasted chicken
Frango à Passarinho,30,20,Fried chicken
Linguiça Calabresa,30,15,Spicy sausage
Peixe Assado,31,25,Grilled fish
Arroz de Marisco,31,20,Seafood rice
Moqueca de Peixe,31,30,Fish stew with coconut milk and vegetables
Porco Preto,32,30,Slow-roasted pork shoulder
Costela Suína,32,25,Barbecued pork ribs
Picanha Suína,32,20,Grilled pork sirloin tip
Pudim de Leite,33,15,Brazilian caramel custard
Brigadeiro,33,10,Brazilian chocolate truffle
Torta de Chocolate,33,15,Brazilian chocolate cake
Picadão,34,15,A traditional Amazonian dish made with shredded beef bacon sausage and vegetables.
Manaus Fish Soup,34,12,A hearty soup made with fish shrimp and vegetables.
Manaus Cheese Bread,34,5,A delicious cheesy bread that is a must-try.
Picanha Steak,35,20,A grilled sirloin steak that is cooked to perfection.
Carne Seca,35,18,A dried beef dish that is slow-cooked until it is tender and flavorful.
Maniçoba,35,15,A traditional Amazonian dish made with black beans pork and vegetables.
Couve à Mineira,36,10,A Brazilian dish made with collard greens bacon sausage and onions.
Feijoada,36,15,A traditional Brazilian dish made with black beans pork and sausage.
Moqueca,36,20,A seafood stew made with coconut milk shrimp fish and vegetables.
Empada de Frango,37,8,A chicken empanada that is filled with chicken cheese and vegetables.
Empada de Queijo,37,7,A cheese empanada that is filled with cheese and vegetables.
Empada de Carne,37,9,A beef empanada that is filled with beef cheese and vegetables.
Brigadeiro,38,5,A Brazilian chocolate truffle that is made with condensed milk chocolate and butter.
Pão de Queijo,38,3,A Brazilian cheese bread that is made with cheese flour and eggs.
Cocada,38,4,A Brazilian coconut candy that is made with coconut milk sugar and eggs.
Bacalhau à Gomes de Sá,39,25,A Portuguese codfish dish that is made with codfish potatoes onions and olives.
Alheira de Mirandela,39,18,A Portuguese sausage that is made with bread chicken and pork.
Francesinha,39,20,A Portuguese sandwich that is made with ham sausage steak cheese and a beer sauce.
Bife de Chorizo,40,30,A tender beef steak with chimichurri sauce.
Alheira,40,20,A traditional Portuguese sausage made from bread chicken and pork.
Fondue Bourguignonne,40,40,A fondue made with beef pork and chicken.
Espeto de Frango,41,15,A grilled chicken skewer served with rice and beans.
Carne de Sol,41,25,A dried salted beef that is typically served with a variety of side dishes.
Moqueca de Peixe,41,30,A fish stew made with coconut milk tomatoes and onions.
Pizza Margherita,42,20,A classic pizza made with tomato sauce mozzarella cheese and fresh basil.
Pizza Quatro Queijos,42,25,A pizza made with four cheeses: mozzarella provolone parmesan and pecorino romano.
Pizza Funghi,42,30,A pizza made with mushrooms mozzarella cheese and a white sauce.
Arroz de Marisco,43,30,A rice dish made with seafood vegetables and spices.
Bobó de Camarão,43,25,A creamy shrimp stew made with coconut milk yams and vegetables.
Vatapa,43,20,A creamy shrimp stew made with peanuts coconut milk and yams.
Caranguejo à Moda da Ilha,44,35,A crab dish made with coconut milk tomatoes and onions.
Caranguejo à Goiana,44,30,A crab dish made with a spicy sauce made with tomatoes onions and peppers.
Caranguejo no Espeto,44,25,A grilled crab skewer served with rice and beans.
Picadão,45,20,A ground beef stew made with tomatoes onions and spices.
Bife à Cavalo,45,25,A beef steak served with fried eggs and onions.
Filé Mignon à Parmegiana,45,30,A beef steak topped with mozzarella cheese and tomato sauce.
Tarator,46,15,A yogurt-based soup made with cucumbers garlic and dill.
Shopska Salada,46,10,A salad made with tomatoes cucumbers onions and peppers.
Kebapche,46,20,A grilled minced meat kebab served with pita bread and vegetables.
Sushi,47,10,A Japanese dish made with vinegared rice and raw fish or vegetables.
Sashimi,47,15,A Japanese dish made with thinly sliced raw fish.
Tempura,47,20,A Japanese dish made with battered and deep-fried seafood or vegetables.
Chicken Parmesan,48,15,A breaded chicken cutlet topped with tomato sauce and mozzarella cheese.
Spaghetti and Meatballs,48,12,Spaghetti noodles with meatballs in a tomato sauce.
Lasagna,48,18,Layers of lasagna noodles meat sauce and ricotta cheese.
Nkwobi,49,15,Beef shank palm oil and egusi soup.
Egusi soup,49,10,Egusi soup spinach and goat meat.
Fufu,49,5,Fufu egusi soup and goat meat.
Ndolé,50,15,Spinach ndolé leaves and beef.
Fonio,50,5,Fonio ndolé and beef.
Salade de plantain,50,10,Plantain salad tomatoes and onions.
Saucisse,51,10,Sausage fries and mayonnaise.
Frites,51,5,Fries mayonnaise and ketchup.
Sauce piquante,51,2,Hot sauce.
Crepes,52,10,Crepes Nutella and bananas.
Gaufre,52,8,Waffles powdered sugar and maple syrup.
Cafe au lait,52,5,Coffee with steamed milk.
Foie gras,53,30,Foie gras brioche and black truffles.
Jambon persillé,53,20,Ham parsley and truffles.
Tarte Tatin,53,15,Apple tart caramel sauce and vanilla ice cream.
Croque monsieur,54,10,Ham and cheese sandwich béchamel sauce and Gruyère cheese.
Salade niçoise,54,15,Niçoise salad tuna olives and hard-boiled eggs.
Soupe à l'oignon,54,10,French onion soup Gruyère cheese and croutons.
Ribs,55,30,Baby back ribs BBQ sauce and coleslaw.
Filet mignon,55,40,Filet mignon mashed potatoes and asparagus.
New York strip,55,35,New York strip mashed potatoes and asparagus.
Crispy Shrimp Tacos,56,14,Crispy shrimp tacos with cabbage cilantro and lime
Crab Cakes,56,18,Crab cakes with remoulade sauce
Shrimp Scampi,56,22,Shrimp scampi with linguine and white wine sauce
Chicken Parmesan,57,16,Chicken parmesan with spaghetti and marinara sauce
Pasta Carbonara,57,18,Pasta carbonara with bacon eggs and Parmesan cheese
Lasagna,57,20,Lasagna with meat sauce and ricotta cheese
Filet Mignon,58,32,Filet mignon with roasted potatoes and asparagus
New York Strip,58,28,New York strip with mashed potatoes and grilled vegetables
Ribeye,58,30,Ribeye with baked potato and broccoli
Baby Back Ribs,59,24,Baby back ribs with BBQ sauce and coleslaw
Sirloin Steak,59,22,Sirloin steak with mashed potatoes and asparagus
Chicken Fajitas,59,20,Chicken fajitas with rice and beans
Chicken Caesar Salad,60,18,Chicken Caesar salad with croutons and Parmesan cheese
Fish and Chips,60,16,Fish and chips with tartar sauce and coleslaw
Mac and Cheese,60,14,Mac and cheese with bread crumbs and cheddar cheese
Peking Duck,61,28,Peking duck with pancakes hoisin sauce and spring onions
Roast Pork,61,26,Roast pork with plum sauce and pickled vegetables
Stir-Fried Shrimp,61,24,Stir-fried shrimp with vegetables and rice
Beijing Beef,62,22,Beijing beef with broccoli and carrots
Kung Pao Chicken,62,20,Kung Pao chicken with peanuts and vegetables
Sesame Chicken,62,18,Sesame chicken with rice or noodles
Stir-Fried Tofu,63,16,Stir-fried tofu with vegetables and rice
Mapo Tofu,63,18,Mapo tofu with ground beef and vegetables
Wonton Soup,63,14,Wonton soup with shrimp pork and vegetables
Peking Duck,64,40,A crispy juicy duck served with pancakes spring onions and hoisin sauce.
Beijing Roasted Fish,64,30,A whole fish that is roasted in a clay oven until it is flaky and flavorful.
Scallop with Black Truffle Sauce,64,50,Scallops that are seared and then sautéed in a black truffle sauce.
Peking Duck,65,35,A crispy juicy duck served with pancakes spring onions and hoisin sauce.
Scallop with Black Truffle Sauce,65,50,Scallops that are seared and then sautéed in a black truffle sauce.
Beijing Roasted Fish,65,30,A whole fish that is roasted in a clay oven until it is flaky and flavorful.
Stir-Fried Beef with Garlic Sauce,66,25,Thinly sliced beef that is stir-fried with garlic and vegetables.
Scallop with Black Truffle Sauce,66,50,Scallops that are seared and then sautéed in a black truffle sauce.
Beijing Roasted Fish,66,30,A whole fish that is roasted in a clay oven until it is flaky and flavorful.
Stir-Fried Chicken with Cashews,67,20,Chicken that is stir-fried with cashews and vegetables.
Scallop with Black Truffle Sauce,67,50,Scallops that are seared and then sautéed in a black truffle sauce.
Beijing Roasted Fish,67,30,A whole fish that is roasted in a clay oven until it is flaky and flavorful.
Stir-Fried Beef with Garlic Sauce,68,25,Thinly sliced beef that is stir-fried with garlic and vegetables.
Scallop with Black Truffle Sauce,68,50,Scallops that are seared and then sautéed in a black truffle sauce.
Beijing Roasted Fish,68,30,A whole fish that is roasted in a clay oven until it is flaky and flavorful.
Stir-Fried Chicken with Cashews,69,20,Chicken that is stir-fried with cashews and vegetables.
Scallop with Black Truffle Sauce,69,50,Scallops that are seared and then sautéed in a black truffle sauce.
Beijing Roasted Fish,69,30,A whole fish that is roasted in a clay oven until it is flaky and flavorful.
Stir-Fried Beef with Garlic Sauce,70,25,Thinly sliced beef that is stir-fried with garlic and vegetables.
Scallop with Black Truffle Sauce,70,50,Scallops that are seared and then sautéed in a black truffle sauce.
Beijing Roasted Fish,70,30,A whole fish that is roasted in a clay oven until it is flaky and flavorful.
Stir-Fried Chicken with Cashews,71,20,Chicken that is stir-fried with cashews and vegetables.
Scallop with Black Truffle Sauce,71,50,Scallops that are seared and then sautéed in a black truffle sauce.
Beijing Roasted Fish,71,30,A whole fish that is roasted in a clay oven until it is flaky and flavorful.
Chicken char siu bao,72,2.5,Steamed barbecued pork buns
Banana tart,72,2,Deep-fried pastry filled with banana and custard
Egg tarts,72,1.5,Portuguese egg tarts with flaky pastry and creamy custard filling
Beef brisket hot pot,73,25,A traditional Chinese hot pot dish made with beef brisket vegetables and broth
Shrimp hot pot,73,30,A hot pot dish made with shrimp vegetables and broth
Chicken hot pot,73,20,A hot pot dish made with chicken vegetables and broth
Mapo tofu,74,15,A spicy Sichuan dish made with tofu ground beef and chili peppers
Kung pao chicken,74,18,A stir-fry dish made with chicken peanuts vegetables and chili peppers
Dry pot chicken,74,20,A spicy Sichuan dish made with chicken vegetables and dry pot sauce
Dan dan noodles,75,10,A Sichuan noodle dish made with hand-pulled noodles chili oil and ground beef
Chongqing chicken,75,15,A spicy Sichuan dish made with chicken vegetables and chili peppers
Biang biang noodles,75,12,A wide hand-pulled noodle dish from Xi'an
Xiaolongbao,76,6,A steamed soup dumpling filled with pork and broth
Shengjianbao,76,5,A pan-fried soup dumpling filled with pork and broth
Jiaozi,76,4,A boiled or steamed dumpling filled with meat vegetables or both
Wuhan hot pot,77,25,A traditional Chinese hot pot dish made with beef vegetables and broth
Shrimp hot pot,77,30,A hot pot dish made with shrimp vegetables and broth
Chicken hot pot,77,20,A hot pot dish made with chicken vegetables and broth
Chuan cai,78,15,A Sichuan dish made with vegetables meat and chili peppers
Mapo tofu,78,15,A spicy Sichuan dish made with tofu ground beef and chili peppers
Kung pao chicken,78,18,A stir-fry dish made with chicken peanuts vegetables and chili peppers
Harbin Da Dong,79,25,A traditional Chinese hot pot dish made with lamb vegetables and broth
Shrimp hot pot,79,30,A hot pot dish made with shrimp vegetables and broth
Chicken hot pot,79,20,A hot pot dish made with chicken vegetables and broth
Harbin Ice Beer,80,2,A refreshing beer made with ice and snow from Harbin
Mantou,80,1,A steamed white bun that is often served with dumplings or other dishes
Pork Belly,80,3,A fatty and flavorful pork belly that is often roasted or braised
Naan,81,2,A large round flatbread that is often served with curries or other dishes
Tandoori Chicken,81,3,Chicken that is marinated in yogurt and spices and then cooked in a tandoor oven
Chicken Tikka Masala,81,4,Chicken that is cooked in a creamy tomato sauce with spices
Longjing Tea,82,2,A type of green tea that is grown in the Hangzhou area
Spring Rolls,82,1,A type of spring roll that is filled with vegetables and shrimp
Fried Dumplings,82,3,A type of dumpling that is filled with pork and vegetables and then fried
West Lake Fish,83,5,A type of fish that is caught in West Lake and then cooked in a variety of ways
Stir-Fried Fish with Vegetables,83,4,A dish of fish that is stir-fried with vegetables and spices
Steamed Fish with Soy Sauce,83,3,A dish of fish that is steamed with soy sauce and ginger
Xiaolongbao,84,2,A type of soup dumpling that is filled with pork and soup and then steamed
Pork Xiaolongbao,84,3,A type of xiaolongbao that is filled with pork
Vegetable Xiaolongbao,84,4,A type of xiaolongbao that is filled with vegetables
Coconut Milk with Sago,85,2,A sweet and refreshing drink made with coconut milk sago and pandan leaves.
Coconut Milk Jelly,85,3,A smooth and creamy jelly made with coconut milk agar-agar and sugar.
Coconut Milk Ice Cream,85,4,A delicious and refreshing ice cream made with coconut milk sugar and cream.
Shrimp with Oyster Sauce,86,10,Shrimp cooked in a savory sauce made with oyster sauce soy sauce ginger and garlic.
Scallops with Black Bean Sauce,86,12,Scallops cooked in a flavorful sauce made with black bean sauce soy sauce ginger and garlic.
Fried Fish with Sweet and Sour Sauce,86,8,Fish fillets fried and coated in a sweet and sour sauce.
Beef Hot Pot,87,15,A traditional Chinese hot pot dish made with beef vegetables and broth.
Seafood Hot Pot,87,20,A hot pot dish made with seafood vegetables and broth.
Vegetarian Hot Pot,87,10,A hot pot dish made with vegetables tofu and broth.
Handan Dumplings,88,5,Dumplings filled with pork chives and soy sauce.
Pork Dumplings,88,4,Dumplings filled with pork ginger and garlic.
Vegetable Dumplings,88,3,Dumplings filled with vegetables ginger and garlic.
Liangpi,89,2,A cold noodle dish made with wheat noodles vinegar sesame oil and chili peppers.
Cold Noodles with Sesame Sauce,89,3,A cold noodle dish made with wheat noodles sesame sauce and vegetables.
Cold Noodles with Peanut Sauce,89,4,A cold noodle dish made with wheat noodles peanut sauce and vegetables.
Braised Chicken,90,10,Chicken braised in a flavorful sauce made with soy sauce ginger and garlic.
Roasted Chicken,90,8,Chicken roasted in a flavorful sauce made with soy sauce ginger and garlic.
Fried Chicken,90,6,Chicken fried in a flavorful batter.
Sour Fish,91,15,A traditional Yunnan dish made with sour fish bamboo shoots and vegetables.
Chicken with Green Pepper,91,12,A flavorful dish of chicken and green peppers in a spicy sauce.
Beef with Broccoli,91,10,A healthy and hearty dish of beef and broccoli in a light sauce.
Crossing Bridge Rice Noodle,92,10,A famous Yunnan dish of rice noodles in a flavorful broth with meat vegetables and peanuts.
Fried Rice Noodle,92,8,A simple but delicious dish of fried rice noodles with vegetables and eggs.
Stir-Fried Rice Noodle,92,12,A flavorful dish of stir-fried rice noodles with meat vegetables and sauce.
Stone Pot Fish,93,20,A delicious and hearty dish of fish cooked in a hot stone pot with vegetables and spices.
Stone Pot Chicken,93,18,A flavorful dish of chicken cooked in a hot stone pot with vegetables and spices.
Stone Pot Beef,93,22,A hearty and satisfying dish of beef cooked in a hot stone pot with vegetables and spices.
Tangyuan,94,5,A traditional Chinese dessert made with glutinous rice flour and filled with sweet fillings.
Jiaozi,94,3,A traditional Chinese dumpling filled with meat or vegetables.
Wonton,94,4,A traditional Chinese dumpling filled with meat or vegetables.
Mutton Soup,95,10,A hearty and flavorful soup made with mutton vegetables and spices.
Lamb Soup,95,12,A delicious and satisfying soup made with lamb vegetables and spices.
Beef Soup,95,8,A hearty and nourishing soup made with beef vegetables and spices.
Shouxing Fish,96,25,A delicious and flavorful fish dish cooked in a special sauce.
Shouxing Chicken,96,20,A flavorful chicken dish cooked in a special sauce.
Shouxing Beef,96,22,A hearty and satisfying beef dish cooked in a special sauce.
Jianbing,97,5,A traditional Chinese savory crepe made with wheat flour vegetables and eggs.
Crispy Pancake,97,3,A crispy pancake made with wheat flour and vegetables.
Stir-Fried Noodles,97,4,A flavorful dish of stir-fried noodles with meat vegetables and sauce.
Baozi,98,2,A traditional Chinese steamed bun filled with meat or vegetables.
Mantou,98,1,A traditional Chinese steamed bun filled with nothing.
Youtiao,98,1,A traditional Chinese fried dough stick.
Handan Dumplings,99,2,Steamed dumplings filled with pork chives and ginger.
Pork Belly with Sticky Rice,99,4,Stir-fried pork belly with sticky rice and scallions.
Stir-Fried Fish with Bean Sprouts,99,3,Stir-fried fish with bean sprouts carrots and onions.
Niujie Rousi,100,5,Roast beef with cumin and coriander.
Beef Noodle Soup,100,6,Noodle soup with beef brisket and vegetables.
Stir-Fried Lamb with Green Beans,100,7,Stir-fried lamb with green beans onions and garlic.
Beef with Pickled Vegetables,101,10,Thin slices of beef in a spicy soup with pickled vegetables.
Spicy Fish Balls,101,8,Fish balls in a spicy soup with chili peppers and peanuts.
Tofu with Minced Pork,101,6,Tofu cubes in a spicy soup with minced pork and vegetables.
Crawfish in Spicy Sauce,102,15,Crawfish in a spicy sauce with chili peppers garlic and ginger.
Crawfish with Salt and Pepper,102,12,Crawfish with salt pepper and garlic.
Crawfish with Garlic Butter,102,10,Crawfish with garlic butter and parsley.
Jiaozi,103,5,Dumplings filled with meat and vegetables steamed or pan-fried
Tanghulu,103,3,Grilled skewers of candied fruit typically hawthorn berries
Mantou,103,2,Steamed buns made from white flour often served with soup or stew
Beijing Roast Duck,104,20,Duck that has been roasted in a wood-fired oven served with pancakes spring onions and hoisin sauce
Peking duck soup,104,10,Soup made from the bones and skin of a roasted duck served with noodles
Stir-fried green beans,104,5,Green beans stir-fried with garlic and soy sauce
Lamian,105,10,Hand-pulled noodles served in a variety of broths and sauces
Hand-pulled noodles with cumin lamb,105,15,Hand-pulled noodles served in a broth with cumin-spiced lamb
Hand-pulled noodles with vegetables,105,8,Hand-pulled noodles served in a broth with vegetables
Shrimp dumplings,106,12,Dumplings filled with shrimp water chestnuts and vegetables steamed or pan-fried
Scallion pancakes,106,6,Thin pancakes made from wheat flour and scallions often served with dipping sauce
Fried rice,106,8,Fried rice made with rice vegetables and meat or seafood
Shrimp Wonton Soup,107,6.99,A delicious soup with shrimp wontons egg dumplings and chives in a flavorful broth.
Fried Pork Dumplings,107,5.99,A classic Taiwanese dish of fried pork dumplings with a savory filling.
Beef Noodle Soup,107,9.99,A hearty soup with tender beef noodles and vegetables in a flavorful broth.
Pearl Milk Tea,108,4.99,A refreshing drink made with black tea milk and tapioca pearls.
Oolong Milk Tea,108,5.99,A flavorful drink made with oolong tea milk and tapioca pearls.
Green Milk Tea,108,6.99,A refreshing drink made with green tea milk and tapioca pearls.
Beef Hot Pot,109,29.99,A shared dish of thinly sliced beef vegetables and noodles cooked in a hot pot.
Shrimp Hot Pot,109,34.99,A shared dish of thinly sliced shrimp vegetables and noodles cooked in a hot pot.
Lamb Hot Pot,109,39.99,A shared dish of thinly sliced lamb vegetables and noodles cooked in a hot pot.
