Dolsot Bibimbap,331,10,A traditional Korean dish of rice mixed with vegetables meat and gochujang sauce served in a hot stone bowl.
Bulgogi Bibimbap,331,12,A Bibimbap with thinly sliced beef.
Japchae Bibimbap,331,14,A Bibimbap with stir-fried glass noodles.
Galbi,332,15,Grilled short ribs marinated in a sweet and savory sauce.
Dak Galbi,332,17,Grilled chicken ribs marinated in a sweet and savory sauce.
Samgyeopsal,332,19,Grilled pork belly.
Sujebi,333,8,A Korean noodle soup made with hand-cut noodles vegetables and meat.
Jjapaguri,333,10,A Korean noodle stir-fry made with Chapagetti and Neoguri noodles vegetables and meat.
Tteokbokki,333,12,A Korean spicy rice cake dish made with rice cakes gochujang sauce and vegetables.
Bibimbap,334,10,A traditional Korean dish of rice mixed with vegetables meat and gochujang sauce served in a hot stone bowl.
Bulgogi Bibimbap,334,12,A Bibimbap with thinly sliced beef.
Japchae Bibimbap,334,14,A Bibimbap with stir-fried glass noodles.
Galbi,335,15,Grilled short ribs marinated in a sweet and savory sauce.
Dak Galbi,335,17,Grilled chicken ribs marinated in a sweet and savory sauce.
Samgyeopsal,335,19,Grilled pork belly.
Daegu Sundubu Jjigae,336,10,Spicy tofu stew with seafood and vegetables
Daegu Bibimbap,336,12,Rice bowl with vegetables meat and egg
Daegu Japchae,336,15,Stir-fried glass noodles with vegetables and meat
Paella Mixta,337,20,Mixed paella with seafood chicken and sausage
Arroz Negro,337,18,Black rice paella with seafood
Gambas al Ajillo,337,15,Shrimp in garlic sauce
Arroz a la Cubana,338,18,Cuban rice dish with ham sausage and vegetables
Paella Valenciana,338,20,Valencian paella with chicken rabbit and vegetables
Picadillo a la Habanera,338,15,Cuban ground beef stew
Tapas Mixta,339,15,Assortment of tapas
Croquetas de Jamón,339,12,Ham croquettes
Patatas Bravas,339,10,Fried potatoes in spicy sauce
Cochinillo Asado,340,30,Roasted suckling pig
Callos a la Madrileña,340,20,Tripe stew
Fabada Asturiana,340,25,Bean stew with sausage ham and bacon
Croquetas de jamón ibérico,341,4, Deep-fried croquettes filled with Iberian ham and béchamel sauce.
Patatas bravas,341,5, Fried potatoes with a spicy tomato sauce.
Gambas al ajillo,341,10, Shrimps sautéed in garlic and olive oil.
Albondigas con salsa de tomate,342,7, Meatballs in tomato sauce.
Paella valenciana,342,15, Traditional Valencian paella made with rice chicken rabbit and seafood.
Arroz negro,342,12, Black rice dish made with squid cuttlefish and shrimp.
Shawarma,343,6, Grilled meat (usually chicken or lamb) served in pita bread with vegetables and sauces.
Falafel,343,5, Deep-fried chickpea balls served in pita bread with vegetables and sauces.
Hummus,343,4, Chickpea dip made with tahini lemon juice and garlic.
Kabsa,344,12, Saudi Arabian rice dish made with meat (usually lamb) vegetables and spices.
Mandi,344,10, Yemeni rice dish made with meat (usually chicken or lamb) vegetables and spices.
Machboos,344,11, Emirati rice dish made with meat (usually chicken or lamb) vegetables and spices.
Foul mudammas,345,4, Fava beans cooked with garlic lemon juice and olive oil.
Ta'ameya,345,5, Egyptian falafel made with fava beans chickpeas and spices.
Koshari,345,6, Egyptian dish made with rice lentils macaroni chickpeas and a tomato sauce.
Mansaf,346,15, Jordanian dish made with lamb rice and a yogurt sauce.
Musakhan,346,12, Palestinian dish made with chicken sumac and onions.
Knafeh,346,8, Sweet cheese pastry soaked in syrup.
Shawarma,347,6, Grilled meat (usually chicken or lamb) served in pita bread with vegetables and sauces.
Falafel,347,5, Deep-fried chickpea balls served in pita bread with vegetables and sauces.
Hummus,347,4, Chickpea dip made with tahini lemon juice and garlic.
Kabab koobideh,348,8, Grilled ground beef kebabs.
Kabab barg,348,9, Grilled ground lamb kebabs.
Tandoori chicken,348,10, Chicken marinated in yogurt and spices and cooked in a tandoor oven.
Soy milk,349,2, Made from soybeans water and salt.
Soybean milk pudding,349,3, Made from soy milk sugar and agar-agar.
Soybean milk ice cream,349,4, Made from soy milk sugar and cream.
Xiao long bao,350,6, Soup dumplings filled with pork and broth.
Steamed pork buns,350,4, Steamed buns filled with pork and vegetables.
Fried pork dumplings,350,5, Fried dumplings filled with pork and vegetables.
Tiramisu,351,10,A classic Italian dessert made with coffee-soaked ladyfingers and a rich creamy mascarpone filling.
Spaghetti Carbonara,351,15,A classic Italian pasta dish made with spaghetti pancetta eggs and Parmesan cheese.
Pasta alla Norma,351,18,A classic Sicilian pasta dish made with eggplant tomatoes ricotta salata and basil.
Pho Ga,352,12,A Vietnamese noodle soup made with chicken broth rice noodles shredded chicken and herbs.
Bun Cha,352,10,A Vietnamese dish of grilled pork patties served with rice noodles herbs and dipping sauce.
Banh Mi,352,8,A Vietnamese sandwich made with baguette meat pickled vegetables and herbs.
Tom Yum Goong,353,15,A Thai soup made with shrimp lemongrass galangal kaffir lime leaves and chili peppers.
Pad Thai,353,12,A Thai stir-fried noodle dish made with rice noodles shrimp chicken or tofu eggs peanuts and bean sprouts.
Green Curry,353,18,A Thai curry made with green chili peppers coconut milk and basil.
Black Cod with Miso,354,50,A whole black cod marinated in miso and charcoal-grilled to perfection.
Stir-Fried Crab with Green Curry,354,40,A delicious stir-fry of crab meat green curry and vegetables.
Truffled Egg with Lobster,354,60,A decadent dish of truffled egg and lobster served on a bed of mashed potatoes.
Antep Fıstıklı Baklava,355,15,A traditional Turkish dessert made with pistachios and honey.
Künefe,355,10,A shredded wheat pastry filled with cheese and syrup.
Dondurma,355,5,A Turkish ice cream made with salep and mastic gum.
Dana Steak,356,60,A grilled tenderloin steak served with your choice of sides.
Izgara Köfte,356,40,A grilled lamb meatball served with your choice of sides.
Karnıyarık,356,30,A stuffed eggplant dish made with ground beef onions tomatoes and peppers.
Adana Kebap,357,30,A spicy grilled lamb kebab served with your choice of sides.
Urfa Kebap,357,30,A mild grilled lamb kebab served with your choice of sides.
Lahmacun,357,15,A thin Turkish pizza made with ground beef onions tomatoes and peppers.
Adana Kebab,358,10,A traditional Turkish dish made of grilled lamb meat.
Urfa Kebab,358,12,A traditional Turkish dish made of grilled lamb meat with a spicy sauce.
Lahmacun,358,8,A thin Turkish pizza topped with ground beef onions tomatoes and spices.
Adana Kebab,359,10,A traditional Turkish dish made of grilled lamb meat.
Urfa Kebab,359,12,A traditional Turkish dish made of grilled lamb meat with a spicy sauce.
Lahmacun,359,8,A thin Turkish pizza topped with ground beef onions tomatoes and spices.
Antep Lahmacun,360,7,A thin Turkish pizza topped with ground beef onions tomatoes and spices and a special sauce.
Küşleme,360,15,A traditional Turkish dish made of grilled lamb meat.
Patlıcan Kebab,360,10,A traditional Turkish dish made of grilled eggplant with a spicy sauce.
Adana Kebab,361,15,Grilled Adana kebab with fresh herbs and spices.
Lahmacun,361,10,Turkish pizza topped with ground beef onions tomatoes and spices.
Küşleme,361,20,Grilled skewered lamb chops.
Simit Söğüş,362,5,A Turkish street food of pita bread filled with cucumber tomato onion and sumac.
Kebap,362,10,Grilled meat kebab.
Izgara Köfte,362,15,Grilled meatballs.
Adana Kebab,363,15,Grilled Adana kebab with fresh herbs and spices.
Urfa Kebab,363,15,Grilled Urfa kebab with fresh herbs and spices.
Lahmacun,363,10,Turkish pizza topped with ground beef onions tomatoes and spices.
Beef Tartare,364,20,Raw beef tartare with shallots capers and Dijon mustard.
Cod with Oyster Mushrooms,364,30,Pan-seared cod with roasted oyster mushrooms and a brown butter sauce.
Whole Roasted Chicken,364,40,Whole roasted chicken with roasted vegetables and a jus.
Beef Wellington,365,50,Beef Wellington with a puff pastry crust and a duxelle filling.
Scallop with Sea Urchin,365,40,Scallop with sea urchin caviar and a yuzu vinaigrette.
Roast Cod,365,35,Roast cod with chorizo potatoes and a salsa verde.
Cacio e Pepe,366,20,Spaghetti with pecorino cheese black pepper and a touch of pasta water.
Linguine with Clams,366,25,Linguine with clams garlic and parsley.
Veal Milanese,366,30,Veal Milanese with a lemon sauce.
Dal Makhani,367,20,A rich and creamy lentil dish with black lentils kidney beans and spices.
Tandoori Chicken,367,25,Grilled tandoori chicken marinated in yogurt and spices.
Naan,367,5,A type of Indian flatbread.
Chicken Shawarma,368,15,Grilled chicken shawarma with hummus tahini and vegetables.
Falafel,368,10,Deep-fried falafel balls with tahini hummus and vegetables.
Hummus,368,5,A dip made from chickpeas tahini lemon juice and garlic.
The Botanist,369,15,A gin and tonic made with botanicals from the garden.
The Botanist Collins,369,18,A gin and citrus cocktail made with botanicals from the garden.
The Botanist Old Fashioned,369,20,A whiskey cocktail made with botanicals from the garden.
Half Smoke,370,5,A half-smoke sausage with chili and cheese.
Mumbo Sauce,370,3,A spicy sauce made with ketchup vinegar and spices.
Ben's Chili Bowl,370,5,A half-smoke sausage with chili and cheese served in a steamed bun.
Chicken Piccata,371,24,Sautéed chicken cutlets with lemon white wine capers and a light sauce.
Shrimp Scampi,371,22,Sautéed shrimp with garlic white wine and butter.
Filet Mignon,371,42,A grilled filet mignon with your choice of sides.
Pizza,372,12,Thin crust pizza with your choice of toppings.
Pasta,372,15,Fresh pasta dishes with your choice of sauce.
Salad,372,10,Salads with your choice of greens toppings and dressing.
The Original Joe,373,20,A slice of pepperoni pizza with a thin crust and a generous amount of toppings.
The Grandma Slice,373,20,A slice of cheese pizza with a thick crust and a simple tomato sauce.
The Sicilian Slice,373,22,A slice of square pizza with a thick crust and a generous amount of toppings.
Pastrami Sandwich,374,22,A large sandwich piled high with pastrami rye bread Swiss cheese and Russian dressing.
Reuben Sandwich,374,24,A grilled sandwich with corned beef sauerkraut Swiss cheese and Russian dressing.
Tuna Salad Sandwich,374,18,A simple sandwich with tuna salad lettuce tomato and mayonnaise on rye bread.
Porterhouse Steak,375,68,A large bone-in steak that is perfect for sharing.
T-Bone Steak,375,58,A smaller bone-in steak that is perfect for one person.
Ribeye Steak,375,52,A flavorful steak with a lot of marbling.
The Deep Dish,376,28,A thick deep-dish pizza with a buttery crust and a generous amount of toppings.
The Thin Crust,376,20,A thin-crust pizza with a crispy crust and a simple tomato sauce.
The Stuffed Pizza,376,32,A deep-dish pizza with a stuffed crust and a generous amount of toppings.
The Chicago Classic,377,26,A deep-dish pizza with sausage pepperoni mushrooms onions and green peppers.
The Spinach & Feta,377,24,A deep-dish pizza with spinach feta cheese garlic and a light sauce.
The Veggie,377,22,A deep-dish pizza with vegetables including mushrooms onions green peppers and black olives.
The Original,378,20,A thin-crust pizza with tomato sauce mozzarella cheese and your choice of toppings.
The Tavern Cut,378,22,A thick-cut pizza with tomato sauce mozzarella cheese and your choice of toppings.
The Stuffed Pizza,378,28,A thin-crust pizza with a stuffed crust and a generous amount of toppings.
The Seafood Tower,379,72,A large tower of seafood with shrimp crab lobster and oysters.
The Ultimate Feast,379,98,A large platter of seafood steak chicken and vegetables.
The Blackened Grouper,379,48,A blackened grouper fillet with a side of rice and vegetables.
The Stone Crab Claws,380,48,A dozen stone crab claws served with a side of mustard sauce.
The Key Lime Pie,380,18,A classic key lime pie with a graham cracker crust.
The Chocolate Lava Cake,380,16,A warm chocolate lava cake with a scoop of vanilla ice cream.
Chicken Fried Chicken,381,18.95, A bone-in hand-breaded chicken breast coated in a seasoned flour mixture and fried to golden brown perfection. Served with two sides.
Macaroni and Cheese,381,12.95, A rich and creamy macaroni and cheese made with three types of cheese and topped with a crispy breadcrumb crust.
Fettuccine Alfredo,381,16.95, A classic Italian dish made with fettuccine noodles tossed in a creamy Alfredo sauce.
The Original,382,2.5, A half-pound of ground beef topped with grilled onions mustard ketchup and mayo on a toasted bun.
Waffle House Special,382,6.99, Two eggs cooked to order two strips of bacon two sausage links and two pancakes.
Grits and Cheese,382,3.99, A bowl of creamy grits topped with melted cheese.
Margherita Pizza,383,12.99, A classic Neapolitan pizza made with fresh mozzarella San Marzano tomatoes and basil.
Pepperoni Pizza,383,14.99, A pizza topped with pepperoni mozzarella and San Marzano tomatoes.
Sicilian Pizza,383,16.99, A thick-crust pizza topped with mozzarella San Marzano tomatoes and your choice of toppings.
The Original Biscuit,384,2.99, A fluffy buttermilk biscuit with sausage gravy.
The Flying Biscuit Breakfast Sandwich,384,6.99, A biscuit with two eggs cheese and your choice of ham bacon or sausage.
The Flying Biscuit Club,384,9.99, A biscuit with two eggs cheese bacon ham and avocado.
Sushi Roll,385,12.95, A variety of sushi rolls made with fresh fish vegetables and rice.
Sashimi,385,14.95, A variety of sashimi made with fresh fish.
Tempura,385,16.95, A variety of tempura made with fresh vegetables and seafood.
Chicken Mole,386,15.95, A rich and flavorful chicken stew made with a mole sauce made from chili peppers chocolate and spices.
Tacos al Pastor,386,12.95, A taco made with spit-roasted pork onions cilantro and pineapple.
Guacamole,386,7.95, A traditional Mexican guacamole made with fresh avocados onions cilantro and lime juice.
Filet Mignon,387,52.95, A 6-ounce filet mignon grilled to your liking.
New York Strip Steak,387,47.95, A 6-ounce New York strip steak grilled to your liking.
Ribeye Steak,387,54.95, A 6-ounce ribeye steak grilled to your liking.
Roast Pork Sandwich,388,7.99,A classic Philly cheesesteak with roasted pork instead of beef.
Cheesesteak,388,7.99,A classic Philly cheesesteak with thinly sliced beef melted cheese and onions.
Roast Chicken,388,8.99,A roasted chicken with mashed potatoes and gravy.
Cheesesteak,389,7.99,A classic Philly cheesesteak with thinly sliced beef melted cheese and onions.
Roast Pork Sandwich,389,7.99,A classic Philly cheesesteak with roasted pork instead of beef.
Chicken Cheesesteak,389,8.99,A Philly cheesesteak with thinly sliced chicken melted cheese and onions.
Cheesesteak,390,7.99,A classic Philly cheesesteak with thinly sliced beef melted cheese and onions.
Roast Pork Sandwich,390,7.99,A classic Philly cheesesteak with roasted pork instead of beef.
Pepperoni Cheesesteak,390,8.99,A Philly cheesesteak with thinly sliced beef melted cheese and pepperoni.
Lobster Roll,391,22,A toasted hot dog bun filled with fresh lobster meat celery and mayonnaise.
Clam Chowder,391,16,A creamy New England-style clam chowder made with fresh clams potatoes and milk.
Fried Shrimp,391,18,A basket of crispy fried shrimp served with tartar sauce.
Chicken Piccata,392,28,Sautéed chicken cutlets in a lemon-caper sauce.
Veal Parmesan,392,26,Sautéed veal cutlets in a Parmesan cheese sauce.
Tiramisu,392,12,A traditional Italian dessert made with ladyfingers coffee and mascarpone cheese.
Filet Mignon,393,58,A grilled filet mignon served with your choice of sides.
Lobster Thermidor,393,48,A lobster dish baked in a creamy cheese sauce.
Crème Brûlée,393,12,A classic French dessert made with custard topped with a caramelized sugar crust.
Beef Tartare,394,28,A raw beef dish seasoned with capers shallots and Dijon mustard.
Seared Scallops,394,32,Seared scallops served with a lemon beurre blanc sauce.
Chocolate Lava Cake,394,16,A warm chocolate cake filled with a gooey chocolate center.
Shrimp Toast,395,12,A crispy wonton filled with shrimp water chestnuts and bean sprouts.
Napa Cabbage Salad,395,10,A salad of Napa cabbage carrots and cucumbers tossed with a sesame vinaigrette.
Chicken Satay,395,14,Grilled chicken skewers served with peanut sauce.
Zuni Roast Chicken,396,28,A roasted chicken served with bread salad and salsa verde.
Pasta Fagioli,396,16,A hearty soup made with beans pasta and tomatoes.
Zuni Coffee Cake,396,8,A moist coffee cake topped with a cinnamon streusel.
Cioppino,397,32,A seafood stew made with clams mussels shrimp and Dungeness crab.
Fish and Chips,397,18,A basket of fried fish and chips served with tartar sauce.
Flan,397,10,A custard dessert made with caramel sauce.
Cioppino,398,32,A seafood stew made with clams mussels shrimp and Dungeness crab.
Filet Mignon,398,58,A grilled filet mignon served with your choice of sides.
Cheesecake,398,12,A classic New York cheesecake.
Seared Scallops,399,32,Seared scallops served with a lemon beurre blanc sauce.
Lobster Roll,399,22,A toasted hot dog bun filled with fresh lobster meat celery and mayonnaise.
Key Lime Pie,399,10,A tart and creamy pie made with key lime juice sweetened condensed milk and whipped cream.
Beef Brisket,400,28,A slow-cooked beef brisket served with mashed potatoes and gravy.
Chicken Fried Steak,400,26,A breaded and fried steak served with mashed potatoes and gravy.
Apple Pie,400,12,A classic apple pie served with vanilla ice cream.
Beef Dip,401,18,A classic beef dip sandwich with thinly sliced beef au jus and horseradish sauce.
Chicken Fried Steak,401,22,A breaded and fried steak served with mashed potatoes gravy and green beans.
Fish and Chips,401,16,A classic fish and chips dish with battered cod french fries and tartar sauce.
Fried Chicken,402,15,A platter of fried chicken with two sides.
Ribs,402,20,A rack of ribs served with two sides.
Beef Brisket,402,25,A tender beef brisket served with two sides.
Enchiladas,403,15,Two enchiladas with your choice of filling rice and beans.
Fajita Plate,403,20,A fajita plate with your choice of meat rice beans and tortillas.
Tacos,403,10,Two tacos with your choice of filling rice and beans.
Filet Mignon,404,40,A 6-ounce filet mignon served with your choice of two sides.
Lobster Bisque,404,18,A creamy lobster bisque served with a side of grilled bread.
Crab Cakes,404,22,A pair of crab cakes served with remoulade sauce.
Oysters Rockefeller,405,25,An appetizer of oysters topped with spinach bacon and Parmesan cheese.
Crawfish Etouffee,405,20,A creamy crawfish etouffee served over rice.
Cheese Grits,405,12,A side of creamy cheese grits.
Enchiladas Suizas,406,15,Two enchiladas topped with white sauce sour cream and guacamole.
Sopa Azteca,406,18,A Mexican soup made with tortilla strips beans and vegetables.
Flautas,406,10,Two flautas with your choice of filling.
Mission Burrito,407,15,A large burrito filled with your choice of meat rice beans and vegetables.
Tacos Al Pastor,407,10,Two tacos filled with pork pineapple and onions.
Quesadillas,407,12,Two quesadillas filled with your choice of filling.
Chicken Fajita Quesadilla,408,14,A quesadilla filled with chicken fajita meat rice beans and cheese.
Steak Fajita Quesadilla,408,16,A quesadilla filled with steak fajita meat rice beans and cheese.
Vegetarian Fajita Quesadilla,408,12,A quesadilla filled with vegetables rice beans and cheese.
Pepperoni Pizza,409,12,A large pepperoni pizza.
Sausage Pizza,409,12,A large sausage pizza.
Mushroom Pizza,409,12,A large mushroom pizza.
Pepperoni and Sausage Pizza,410,14,A large pepperoni and sausage pizza.
Mushroom and Sausage Pizza,410,14,A large mushroom and sausage pizza.
Pepperoni and Mushroom Pizza,410,14,A large pepperoni and mushroom pizza.
Nashville Hot Chicken,411,8,Fried chicken coated in a hot and spicy sauce
Cheese Curds,411,5,Battered and deep-fried cheese curds served with ranch dressing
Mac and Cheese,411,6,Creamy macaroni and cheese topped with bread crumbs
Filet Mignon,412,65,A 6-ounce filet mignon cooked to your liking
Ribeye Steak,412,55,A 12-ounce ribeye steak cooked to your liking
Lobster Bisque,412,25,A rich and creamy lobster bisque
Chicken Pot Pie,413,18,A classic chicken pot pie with a flaky crust and a creamy filling
Braised Short Ribs,413,35,Fall-off-the-bone braised short ribs served with mashed potatoes and vegetables
Steak Frites,413,30,A grilled New York strip steak served with fries and a béarnaise sauce
Duck Confit Tacos,414,16,Two soft tacos filled with duck confit roasted vegetables and a chipotle sauce
Crispy Brussels Sprouts,414,12,Crispy Brussels sprouts tossed in a balsamic glaze
Mole Negro,414,22,A rich and flavorful mole sauce made with chocolate chiles and spices
Sopa Azteca,415,15,A traditional Mexican soup made with tortilla chips shredded chicken beans and vegetables
Enchiladas Rojas,415,18,Two enchiladas filled with your choice of meat or cheese topped with red sauce cheese and sour cream
Flautas,415,16,Three flautas filled with your choice of meat or cheese topped with green sauce cheese and sour cream
Crab and Corn Chowder,418,15,A creamy chowder with fresh crab and corn
Cioppino,418,25,A seafood stew with clams mussels shrimp and Dungeness crab
Fish and Chips,418,18,Fresh fish and chips served with tartar sauce and malt vinegar
Fish Tacos,417,12,Two flour tortillas filled with grilled fish cabbage pico de gallo and avocado
Enchiladas Rojas,417,15,Three corn tortillas filled with your choice of meat cheese and beans topped with red sauce and sour cream
Mole Poblano,417,18,Chicken in a rich dark mole sauce with chocolate chilies and spices
Beef Brisket,416,25,A tender smoky beef brisket served with mashed potatoes and vegetables
Pork Chops,416,20,Thick-cut pork chops grilled to perfection and served with roasted vegetables
Shrimp Scampi,416,22,Shrimp sautéed in a garlic butter sauce with white wine and lemon
Cioppino,419,25,A seafood stew with clams mussels shrimp and Dungeness crab
Shrimp Scampi,419,22,Shrimp sautéed in a garlic butter sauce with white wine and lemon
Crab Legs,419,35,A pound of fresh crab legs served with melted butter
Filet Mignon,420,50,A 6-ounce filet mignon cooked to your liking
Canlis Salad,420,18,A mixed greens salad with grilled asparagus goat cheese and a balsamic vinaigrette
Seared Scallops,420,32,Four seared scallops served with a lemon beurre blanc sauce
Filet Mignon,421,30,A 6-ounce center-cut filet mignon grilled to your liking and served with your choice of two sides.
Fried Oysters,421,15,A dozen fresh oysters lightly battered and fried to perfection.
Oysters Rockefeller,421,20,A dozen fresh oysters topped with spinach bacon and Parmesan cheese and baked until bubbly.
Fried Chicken,422,18,A half-chicken breaded and fried to golden brown perfection.
Country Ham,422,16,A thick slice of country ham cured and smoked to perfection.
Macaroni and Cheese,422,12,A classic comfort food made with elbow macaroni and a creamy cheese sauce.
New York Strip Steak,423,45,An 8-ounce center-cut New York strip steak grilled to your liking and served with your choice of two sides.
Lobster Bisque,423,25,A rich and creamy lobster bisque made with fresh lobster cream and sherry.
Crab Cakes,423,20,A pair of crab cakes made with fresh crab meat bread crumbs and spices.
Shish Kebab,424,20,A skewer of grilled lamb chicken or beef served with your choice of rice or vegetables.
Plov,424,15,A traditional Uzbek rice pilaf made with lamb carrots and onions.
Lagman,424,20,A hand-pulled noodle soup made with lamb vegetables and a spicy sauce.
Beef Plov,425,20,A traditional Uzbek rice pilaf made with beef carrots and onions.
Lagman,425,20,A hand-pulled noodle soup made with beef vegetables and a spicy sauce.
Manty,425,15,A steamed dumpling filled with ground beef and onions.
Beef Chorba,426,15,A traditional Uzbek beef soup made with noodles vegetables and a spicy sauce.
Lagman,426,20,A hand-pulled noodle soup made with beef vegetables and a spicy sauce.
Plov,426,15,A traditional Uzbek rice pilaf made with beef carrots and onions.
Pho Ga,427,8,Vietnamese chicken noodle soup
Pho Bo,427,10,Vietnamese beef noodle soup
Bun Bo Hue,427,12,Vietnamese spicy beef noodle soup
Bun Cha,428,7,Vietnamese grilled pork noodle soup
Nem Cuon,428,5,Vietnamese spring rolls
Banh Mi,428,4,Vietnamese baguette sandwich
Bun Bo Hue,429,10,Spicy beef noodle soup with rice noodles pork blood and herbs.
Banh Xeo,429,8,Vietnamese crepes made with rice flour turmeric and shrimp.
Goi Cuon,429,5,Spring rolls filled with pork shrimp and vegetables.
Com Tam,430,6,Broken rice with grilled pork shrimp and egg.
Bun Thit Nuong,430,7,Rice noodles with grilled pork and vegetables.
Banh Xeo,430,8,Vietnamese crepes made with rice flour turmeric and shrimp.
Pho Ga,431,8,Vietnamese chicken noodle soup
Bun Bo Hue,431,10,Vietnamese beef noodle soup
Pho Bac Ha,431,9,Vietnamese beef noodle soup from Ha Giang province
Bun Cha Ha Noi,432,12,Vietnamese grilled pork and noodle dish
Cha Ca Ha Noi,432,15,Vietnamese turmeric fish grilled over charcoal
Bun Cha Que Huong,432,10,Vietnamese grilled pork and noodle dish from Hue
Souvlaki,433,10,Grilled Greek skewers of meat chicken or vegetables
Gyro,433,12,Grilled Greek pita sandwich with meat vegetables and tzatziki sauce
Moussaka,433,15,Greek eggplant casserole with ground beef béchamel sauce and cheese
Grilled Octopus,434,18,Grilled octopus with lemon olive oil and oregano.
Chicken Souvlaki,434,12,Chicken souvlaki with rice tzatziki and grilled vegetables.
Mousaka,434,15,Layers of eggplant ground beef and béchamel sauce.
Grilled Salmon,435,22,Grilled salmon with lemon dill and capers.
Chicken Tzatziki,435,16,Chicken breast with tzatziki sauce.
Falafel Plate,435,12,Falafel with hummus tahini and vegetables.
Bacon Cheeseburger,436,10,Bacon cheeseburger with lettuce tomato onion and pickles.
Build-Your-Own Burger,436,12,Build your own burger with your choice of toppings.
