Al-Shaab,115,10,This popular Sudanese restaurant is known for its delicious ful medames (a stewed fava bean dish).
Al-Aziz,115,15,This upscale restaurant offers a wide variety of traditional Sudanese dishes.
Al-Mahatta,115,20,This casual restaurant is a great place to try some of the city's best street food.
Al-Rifai,116,10,This family-run restaurant is known for its delicious hummus and baba ganoush.
Al-Shami,116,15,This popular restaurant offers a wide variety of traditional Syrian dishes.
Al-Amin,116,20,This casual restaurant is a great place to try some of the city's best street food.
Fuhang Soy Milk,117,5,This famous soy milk shop has been serving up delicious soy milk and tofu dishes since 1939.
Din Tai Fung,117,10,This world-famous chain restaurant is known for its delicious xiao long bao (steamed dumplings).
Mia Cucina,117,15,This Italian restaurant offers a wide variety of authentic Italian dishes.
Le Du,118,20,This Michelin-starred restaurant offers a modern take on Thai cuisine.
Nahm,118,30,This award-winning restaurant offers a traditional Thai dining experience.
Gaggan,118,40,This world-famous restaurant offers a progressive take on Thai cuisine.
Mado,119,15,Turkish restaurant with a wide variety of desserts and pastries.
Nusr-et Steakhouse,119,50,Steakhouse known for its dry-aged steaks and celebrity clientele.
Kebapçıoğlu,119,20,Turkish restaurant that specializes in kebabs.
İmam Çağdaş,120,20,Turkish restaurant that is known for its çiğ köfte.
Kebapçı Yaşar Usta,120,25,Turkish restaurant that specializes in kebabs.
Gaziantep Mutfağı,120,30,Turkish restaurant that serves traditional Gaziantep cuisine.
Adana Ocakbaşı,121,20,Turkish restaurant that specializes in kebabs.
Kebapçıoğlu,121,25,Turkish restaurant that serves traditional Adana cuisine.
Şahin Usta Kebap Salonu,121,30,Turkish restaurant that is known for its Adana kebabs.
The Barbary,122,25,British restaurant that serves traditional British cuisine.
The Ledbury,122,50,Michelin-starred restaurant that serves modern British cuisine.
Cecconi's,122,35,Italian restaurant that serves classic Italian dishes.
Lasan,123,25,Indian restaurant that serves traditional Indian cuisine.
Al-Amir,123,20,Lebanese restaurant that serves traditional Lebanese cuisine.
The Botanist,123,30,Modern British restaurant that serves seasonal dishes.
Ben's Chili Bowl,124,5,A D.C. institution since 1958 serving up half-smokes chili dogs and milkshakes.
The Old Ebbitt Grill,124,25,A historic Georgetown restaurant with a lively bar scene and a menu of classic American dishes.
The Red Hen,124,30,A James Beard Award-winning Italian restaurant in Penn Quarter.
Joe's Pizza,125,15,A New York City institution since 1975 serving up slices of classic New York-style pizza.
Katz's Delicatessen,125,20,A New York City institution since 1888 serving up pastrami sandwiches corned beef and matzo ball soup.
Peter Luger Steak House,125,60,A Brooklyn steakhouse that's been around since 1887.
Lou Malnati's Pizzeria,126,20,A Chicago-style deep dish pizza chain with several locations throughout the city.
Gino's East,126,20,Another Chicago-style deep dish pizza chain with several locations throughout the city.
Pizzeria Uno,126,20,The original Chicago-style deep dish pizza restaurant founded in 1943.
The Rusty Pelican,127,30,A seafood restaurant with several locations in South Florida.
Joe's Stone Crab,127,50,A Miami Beach institution since 1913 known for its stone crabs.
The Cheesecake Factory,127,25,A chain restaurant with a wide variety of American dishes including pasta seafood and steak.
The Varsity,128,6,Classic Atlanta hot dog joint
Antico Pizza Napoletana,128,15,Authentic Neapolitan pizza
The Flying Biscuit Cafe,128,10,Southern comfort food
Tei-An,129,20,Japanese omakase
Meso Maya,129,15,Modern Mexican cuisine
Nick & Sam's Steakhouse,129,50,Upscale steakhouse
Reading Terminal Market,130,10,Historic food hall with a variety of vendors
Jim's Steaks,130,7,Famous cheesesteaks
Pat's King of Steaks,130,7,Another famous cheesesteaks
Legal Sea Foods,131,25,High-end seafood restaurant
Davio's,131,40,Upscale Italian restaurant
Top of the Hub,131,35,Fine dining restaurant with panoramic views of the city
The Progress,132,50,Modern American cuisine with a focus on locally-sourced ingredients
State Bird Provisions,132,35,Small plates restaurant with a focus on seasonal ingredients
Zuni Cafe,132,30,Classic San Francisco restaurant serving California cuisine
The Fish Market,133,30,Casual seafood restaurant with a large selection of fresh fish
George's at the Cove,133,50,Fine dining seafood restaurant with stunning views of the Pacific Ocean
The Oceanaire Seafood Room,133,40,Upscale seafood restaurant with a focus on fresh fish and shellfish
San Pedro Square Market,134,20,Food hall with a variety of vendors serving a variety of cuisines
Original Joe's,134,30,Italian restaurant that has been serving San Jose for over 100 years
Armadillo Willy's,134,20,Tex-Mex restaurant with a lively atmosphere
The Original Ninfa's on Navigation,135,30,Tex-Mex restaurant that is known for its fajitas
Hugo's,135,40,Fine dining Tex-Mex restaurant with a focus on fresh ingredients
Brennan's,135,50,New Orleans-inspired restaurant with a focus on classic Creole cuisine
El Charro Cafe,136,15,Authentic Mexican food in a historic building.
The Mission,136,18,California-style Mexican food with a large outdoor patio.
Z'Tejas Southwestern Grill,136,20,Upscale Southwestern cuisine with a lively bar scene.
Buddy's Pizza,137,15,Detroit-style pizza with a thick crust and generous toppings.
Loui's Pizza House,137,12,Authentic Detroit-style pizza in a casual setting.
Green Dot Stables,137,10,Fast-casual Detroit-style pizza with a variety of toppings.
Elway's,138,30,Steakhouse with a celebrity chef and a lively bar scene.
The Kitchen,138,25,Modern American cuisine with a focus on locally-sourced ingredients.
Lola,138,20,Spanish tapas and small plates in a lively atmosphere.
Fonda San Miguel,139,25,Upscale Mexican restaurant with a focus on traditional dishes
Biga on the Banks,139,20,Italian restaurant with a riverfront view
The Original Mexican Restaurant,139,15,Casual Mexican restaurant with a wide variety of dishes
Ivar's Acres of Clams,140,20,Clam chowder and seafood restaurant with a waterfront location
The Crab Pot,140,25,Seafood restaurant with a variety of seafood dishes
Canlis,140,50,Fine dining restaurant with a tasting menu
The Southern Steak & Oyster,141,30,Steakhouse with a focus on Southern cuisine
Arnold's Country Kitchen,141,15,Casual Southern restaurant with a focus on comfort food
The Palm,141,35,Steakhouse with a focus on classic American cuisine
Chashlik House,142,10,Uzbek restaurant serving grilled meats plov and other traditional dishes.
Laziz Usta,142,15,Restaurant serving traditional Uzbek cuisine in a modern setting.
Shahriston,142,20,Upscale restaurant serving traditional Uzbek cuisine in a historic setting.
Pho 24,143,5,Chain restaurant serving Vietnamese pho noodle soup.
Bun Cha Huong Lien,143,10,Casual restaurant serving Vietnamese grilled pork and noodle dishes.
Bun Bo Hue An Nam,143,15,Restaurant serving Vietnamese beef noodle soup from Hue.
Quan An Ngon,144,5,Casual restaurant serving Vietnamese street food.
Pho Thin,144,10,Restaurant serving Vietnamese pho noodle soup.
Bun Cha Huong Que,144,15,Restaurant serving Vietnamese grilled pork and noodle dishes.
O Thanasis,145,10,Traditional Greek taverna serving grilled meats seafood and meze dishes.
Manos,145,15,Upscale Greek restaurant serving modern takes on traditional dishes.
Strofi,145,20,Fine-dining Greek restaurant with a focus on seafood.
The Counter,146,15,Build-your-own burger chain with a wide variety of toppings and sauces.
Umami Burger,146,20,Modern Japanese-inspired burger joint with a focus on umami flavor.
In-N-Out Burger,146,10,California-based fast food chain known for its fresh made-to-order burgers.
The Flying Goat,147,15,Cozy coffee shop and restaurant with a focus on local organic ingredients.
The Yards Bruncheon,147,20,Farm-to-table restaurant with a seasonal menu and a large outdoor patio.
Dough Zone,147,15,Dumpling house serving up a variety of traditional and creative dumplings.
